company,title,published_date
AAPL,Why Apple's App Store restrictions won't 'change the game',2025-05-03
AAPL,Nvidia CEO Jensen Huang gets first salary boost in 10 years,2025-05-03
AAPL,Apple would be 'smart' to eat tariff costs to keep prices steady,2025-05-03
AAPL,Buffett Credits Apple's Tim Cook for Berkshire Gains,2025-05-03
AAPL,Buffett Thanks Apple CEO Tim Cook,2025-05-03
AAPL,"Mark Zuckerberg's Meta dreams, Microsoft's earnings smash, and Reddit's surprise: Tech news roundup",2025-05-03
AAPL,Investing.com’s stocks of the week,2025-05-03
AAPL,Apple's Tariff Impact: 10 Things Investors Should Know,2025-05-03
AAPL,"Earnings Remain Resilient, but Outlook Softens",2025-05-03
AAPL,Is Apple Inc. (AAPL) the Best NASDAQ Stock to Buy According to Billionaires?,2025-05-03
AAPL,Apple (AAPL) Hit by $900 Million Tariff Impact as Supply Chain Shifts to India,2025-05-03
AAPL,"Stocks to Watch Recap: Amazon, Block, Apple, Take-Two",2025-05-03
AAPL,Microsoft Beats Apple to Become Largest U.S. Company by Market Cap,2025-05-03
AAPL,The AI Trade Is Showing New Signs of Life. What We Learned From Big Tech Earnings.,2025-05-03
AAPL,Tim Cook Tells Commerce Secretary Lutnick How Apple 'Could' Bring iPhone Manufacturing To US,2025-05-03
AAPL,"Apple CEO Tim Cook Warns Of $900 Million Tariff Impact In June Quarter, Expects Majority Of iPhones Sold In US To Be Made In India",2025-05-03
AAPL,"These Stocks Moved the Most Today: Apple, Amazon, Block, Take-Two, Dexcom, MicroStrategy, Duolingo, Roku, and More",2025-05-03
AAPL,"Apple Beats Q2, Flags Tariff Headwinds",2025-05-03
AAPL,Stock Market Today: Dow Jones Gains More Than 500 Points; Spotify Hits A Buy Point (Live Coverage),2025-05-03
AAPL,Stocks climb back to ‘Liberation Day’ levels after surprise jobs report,2025-05-03
AAPL,"Apple Stock Sinks On Tariffs, Services Challenges",2025-05-03
AAPL,Spotify updating app for US users after court ruling in Apple case,2025-05-03
AAPL,Why Apple (AAPL) Stock Is Falling Today,2025-05-03
AAPL,"Apple partnering with startup Anthropic on AI-powered coding platform, Bloomberg News reports",2025-05-03
AAPL,"Apple's $150 Billion Meltdown: Tariffs, China Trouble, and a Shrinking Buyback Spook Wall Street",2025-05-03
AAPL,Tarrifs in focus as Apple follows up ‘best quarter ever’,2025-05-03
AAPL,"Apple, Anthropic Team Up to Build AI-Powered ‘Vibe-Coding’ Platform",2025-05-03
AAPL,"US Equity Indexes Jump Following Strong Jobs Report, Easing China Trade Tensions",2025-05-03
AAPL,Apple (NasdaqGS:AAPL) Announces $100 Billion Buyback and Crypto Integration With Mesh,2025-05-03
AAPL,How a judge's scathing rebuke to Apple could change the app store,2025-05-03
AAPL,What Apple Earnings Reveal About Trump’s Trade War,2025-05-03
AAPL,Here's what top C-suites are saying about tariffs,2025-05-03
AAPL,"Magnificent Seven Stocks: Meta, Nvidia, Tesla Rally; Apple Dives On Earnings",2025-05-03
AAPL,"US Equity Indexes Rise as Strong Jobs Report Counters Bearish Apple, Amazon Signals",2025-05-03
AAPL,Gold Heads for First Back-To-Back Weekly Losses This Year,2025-05-03
AAPL,The Dow jumps 600 points as a solid jobs report has Trump calling for interest rate cuts again,2025-05-03
AAPL,"Apple earnings takeaways: A rush to buy iPhones before tariffs, a $900 million hit, and more",2025-05-03
AAPL,Can S&P 500 ETFs Continue Their Winning Streak?,2025-05-03
AAPL,Apple Stock Slips Amid Worries About Tariff Impact,2025-05-03
AAPL,Why Shares of Apple Are Sinking Today,2025-05-03
AAPL,"Top Stock Movers Now: Dexcom, Berkshire Hathaway, Nvidia, and More",2025-05-03
AAPL,Top Midday Stories: Stocks Rise on Better-Than-Expected Jobs Report; Apple Forecasts $900 Million Tariff Hit in Fiscal Q3,2025-05-03
AAPL,"Stock Market Powers Higher On Microsoft, Meta, Trump Tariff Hopes: Weekly Review",2025-05-03
AAPL,"Apple Fiscal Q2 Results Driven by Product Demand, China Resilience, Morgan Stanley Says",2025-05-03
AAPL,Apple says tariffs will cost it a whopping $900 million this quarter,2025-05-03
AAPL,"Apple ordered to pay Optis $502M in UK patent dispute, Reuters says",2025-05-03
AAPL,Apple Shares Tumble After Flags $900M Q3 Tariff Hit Despite Strong Q2,2025-05-03
AAPL,"Amazon & Apple earnings, TSM to expand in US, Temu vs. tariffs",2025-05-03
AAPL,"Apple Leans on India to Navigate China Tariff Risks, Wedbush Says",2025-05-03
AAPL,"Apple Q2 Earnings Beat Estimates, Services Drive Top-Line Growth",2025-05-03
AAPL,Apple Stock Falls After iPhone Maker Warns of Heavy Tariff Cost,2025-05-03
AAPL,Apple Stock Drops. Why a $900 Million Tariff Hit Could Be Just the Start.,2025-05-03
AAPL,Apple Beats on Q2 Earnings but Shares Slip: ETFs to Watch,2025-05-03
AAPL,A Giant Crack Appears in Tim Cook’s Walled Garden,2025-05-03
AAPL,"Apple downgraded, Reddit upgraded: Wall Street's top analyst calls",2025-05-03
AAPL,"Apple Hit With Downgrades as Tariff, Growth Worries Increase",2025-05-03
AAPL,"TSX closes positive on calming trade tensions, strong U.S. jobs report",2025-05-03
AAPL,Q2 2025 Apple Inc Earnings Call,2025-05-03
AAPL,"Jobs report, China trade, Apple & Amazon earnings: 3 Things",2025-05-03
AAPL,Spotify's US app update with purchase links gets Apple approval,2025-05-03
AAPL,Spotify Says Apple Approves App Update With External Payment Links,2025-05-03
AAPL,Dow Jones Futures Rise As China Says It's 'Evaluating' U.S. Trade Talks. Apple Falls On Earnings.,2025-05-03
AAPL,5 Things to Know Before the Stock Market Opens,2025-05-03
AAPL,Breakfast News: China Considers Trade Talks,2025-05-03
AAPL,Apple to source 19 billion chips from US this year,2025-05-03
AAPL,Jim Cramer on Apple Inc. (AAPL): ‘The Most Obvious Story in America for Years and Years’,2025-05-03
AAPL,Why Apple's possible $900M tariff hit 'could be worse',2025-05-03
AAPL,Apple sees sharp narrative shift as tariffs dominate tech giant's outlook,2025-05-03
AAPL,Morning Bid: Buy in May?,2025-05-03
AAPL,"The Market Rally Is Strong, This Would Send It Stratospheric. And 5 Other Things to Know Today.",2025-05-03
AAPL,"Social Buzz: Wallstreetbets Mostly Higher Pre-Bell Friday; Reddit to Advance, Apple to Decline",2025-05-03
AAPL,"Wall Street stocks buoyed by strong economic data, possible US-China trade talks",2025-05-03
AAPL,"Apple violated app payments injunction, judge rules",2025-05-03
AAPL,Apple Fiscal Second-Quarter Results Top Street Views; Flags $900 Million in Tariff-Related Costs,2025-05-03
AAPL,"Apple CEO Estimates $900 Million Hit to Costs in June Quarter From Tariffs, Says 19 Billion Chips Coming From US",2025-05-03
AAPL,Tech investing playbook: Evolution of Big Tech dominance,2025-05-03
AAPL,What Big Tech Has Going for It in the Trade War,2025-05-03
AAPL,"Apple shares fall as buyback cuts, tariff fears fan investor jitters",2025-05-03
AAPL,Apple changes US App Store rules to let apps link to external payment systems,2025-05-03
AAPL,"Trending tickers: Apple, Amazon, Reddit, Airbnb and Standard Chartered",2025-05-03
AAPL,Members of Congress Are Buying These 4 Warren Buffett Stocks. Should You?,2025-05-03
AAPL,"Trump’s tariffs could cost Apple $900 million this quarter, CEO Tim Cook says",2025-05-03
AAPL,Apple Inc (AAPL) Q2 2025 Earnings Call Highlights: Record Revenue and Strategic Investments ...,2025-05-03
AAPL,"Analysis-Amazon sellers are stocking up in the face of tariffs, but it's a short-term fix",2025-05-03
AAPL,"Morning Bid: Bright signs from Beijing, bad omens from Apple",2025-05-03
AAPL,Why robots are not the answer to US manufacturing reshoring hopes,2025-05-03
AAPL,Apple to Source Billions of US-Made Chips in Supply Chain Shift,2025-05-03
AAPL,Spotify submits app update to Apple with external link for purchases in US,2025-05-03
AAPL,Apple CEO Tim Cook reveals how much Trump’s tariffs will cost the tech giant this quarter,2025-05-03
AAPL,Apple earnings call: Biggest takeaways & comments from Tim Cook,2025-05-03
AAPL,Tariffs To Take a Bite Out of Apple's Results,2025-05-03
AAPL,"Apple Says Most of Its Devices Shipped Into U.S. Will Be From India, Vietnam",2025-05-03
AAPL,How Apple stock tends to trade following earnings,2025-05-03
AAPL,Apple in 'early innings' of post-tariff adjustment phase,2025-05-03
AAPL,Apple warns of $900m hit from Trump’s trade war,2025-05-03
AAPL,Consumers Didn't Hoard iPhones in Advance of Tariffs,2025-05-03
AAPL,Apple earnings beat expectation as Americans rush to buy iPhones before tariffs,2025-05-03
AAPL,Apple Tops March-Quarter Targets On Record Services Revenue. But Stock Slips.,2025-05-03
AAPL,"Compared to Estimates, Apple (AAPL) Q2 Earnings: A Look at Key Metrics",2025-05-03
AAPL,Apple Continues to See Stronger Demand for AI Products,2025-05-03
AAPL,Apple Expects to Pay a Wide Variety of Tariff Rates,2025-05-03
AAPL,Apple: Growth in a Difficult Environment,2025-05-03
AAPL,Apple (AAPL) Q2 Earnings and Revenues Surpass Estimates,2025-05-03
AAPL,Apple: Why this analyst isn't 'too concerned' about China tariffs,2025-05-03
AAPL,Apple Q2 earnings: A breakdown of Apple's services segment,2025-05-03
AAPL,"Apple Delivers Better-Than-Expected iPhone Sales, Announces $100B Buyback",2025-05-03
AAPL,Tariffs Will Have Limited Impact on Apple Costs,2025-05-03
AAPL,Tim Cook on an AI Powered Siri: ‘We Need More Time’,2025-05-03
AAPL,Apple Leans on Developing Markets,2025-05-03
AAPL,Tim Cook Opens the Call Touting U.S. Manufacturing,2025-05-03
AAPL,US judge finds Apple to be in violation of antitrust order,2025-05-03
AAPL,Apple's China Sales Drop As Trade Tensions Heat Up,2025-05-03
AAPL,"Apple posts stronger-than-expected Q2 results, says majority of US iPhones sold will come from India",2025-05-03
AAPL,Apple's Margins Come in Light,2025-05-03
AAPL,Apple Increases Its Dividend,2025-05-03
AAPL,Apple's iPhone Sales Beat. But Sales in China Missed.,2025-05-03
AAPL,"Apple iPhone revenue tops estimates, Services falls short",2025-05-03
AAPL,Apple’s (NASDAQ:AAPL) Q1 Sales Beat Estimates,2025-05-03
AAPL,Apple's Installed Base Hits New All-Time High,2025-05-03
AAPL,"Apple girds for more trade war pain, trims buyback",2025-05-03
AAPL,Apple reports second quarter results,2025-05-03
AAPL,Apple Ordered to Pay $502M in Patent Dispute With Optis; Stock Flat,2025-05-03
AAPL,The Nasdaq soars as Big Tech earnings have stocks shrugging off recession alarms,2025-05-03
AAPL,"These Stocks Moved the Most Today: Microsoft, Eli Lilly, Kohl’s, Apple, Tesla, Meta, Qualcomm, CVS, and More",2025-05-03
AAPL,Apple Stock Closes Slightly Up Ahead of Earnings,2025-05-03
AAPL,Investors Await Apple's Forecast,2025-05-03
AAPL,"Microsoft, Meta Gains Help Lift Equities Ahead of Apple Earnings",2025-05-03
AAPL,Sector Update: Tech Stocks Climb Thursday Afternoon,2025-05-03
AAPL,Apple Faces Billions-Risk from App Store Ruling,2025-05-03
AAPL,"Tariffs, economy will dominate Apple, Amazon earnings",2025-05-03
AAPL,Judge says CEO Tim Cook 'chose poorly' as Apple ignored App Store order,2025-05-03
AAPL,Microsoft Briefly Nabs Apple's Crown,2025-05-03
AAPL,Apple (NasdaqGS:AAPL) Embraces Crypto with Mesh Partnership for Apple Pay Integration,2025-05-03
AAPL,Qualcomm Shares Plunge 8% on Weak Guidance Despite Solid Q2 Beat,2025-05-03
AAPL,"Update: Apple Must Pay Optis $502 Million in Patent Infringement Case, UK Court Rules",2025-05-02
AAPL,Apple Hit With Legal Bombshell Just Hours Before Earnings -- Here's What Wall Street's Missing,2025-05-02
AAPL,Big Tech Stocks Have Had a Magnificent Day So Far,2025-05-02
AAPL,Apple Reshuffles Global Affairs and Music Divisions in Major Reorganization,2025-05-02
AAPL,Explainer-What's next for Apple after US court's contempt order in Epic Games case?,2025-05-02
AAPL,Judge Finds Apple Violated Antitrust Ruling,2025-05-02
AAPL,ChatGPT: Everything you need to know about the AI-powered chatbot,2025-05-02
AAPL,CCME launches to take on anti-competitive smartphone platform duopoly,2025-05-02
AAPL,Moffett: I Am Not a Bear on Apple,2025-05-02
AAPL,Fortnite plans return to the US iOS App Store next week,2025-05-02
AAPL,Warren Buffett Stocks: What's Inside Berkshire Hathaway's Portfolio?,2025-05-02
AAPL,Apple Stock Opens Lower,2025-05-02
AAPL,Apple Inc. (AAPL): Jim Cramer Braces for Earnings — “We Think They’re Going to Miss”,2025-05-02
AAPL,How To Earn $500 A Month From Apple Stock Ahead Of Q2 Earnings,2025-05-02
AAPL,"Big Tech earnings, Amazon & Apple, Tesla denies search: 3 Things",2025-05-02
AAPL,The most bought US stocks in Trump's first 100 days,2025-05-02
AAPL,Apple Stock Falls Ahead of Earnings,2025-05-02
AAPL,Nasdaq Plan Will Bring Zero-Day Option Boom Closer to Single Stocks,2025-05-02
AAPL,Mag 7 Ride to Market’s Rescue But It Needs Much More and 5 Other Things to Know Today.,2025-05-02
AAPL,US judge finds Apple in violation of App Store reform order,2025-05-02
AAPL,"Trending tickers: Microsoft, Meta, Nvidia, Tesla and Rolls-Royce",2025-05-02
AAPL,"Big Tech's fortunes diverge as AI powers cloud, tariffs hit consumer electronics",2025-05-02
AAPL,Apple's Q2 earnings are a 'must watch.' Here's why.,2025-05-02
AAPL,Stock Market Sell-Off: 2 Brilliant Stocks to Buy on the Dip and Hold for 10 Years,2025-05-02
AAPL,How to find and cancel forgotten online subscriptions that are costing you a fortune,2025-05-02
AAPL,Stocks To Watch in May—And What to Watch For,2025-05-02
AAPL,US judge refers Apple for possible criminal contempt probe,2025-05-02
AAPL,Zacks Investment Ideas feature highlights: Apple and Amazon,2025-05-02
AAPL,"The Zacks Analyst Blog Highlights Apple, Affirm, Compass and CyberArk",2025-05-02
AAPL,"Apple executive ‘outright lied under oath’, court finds",2025-05-02
AAPL,The month that Trump blinked on trade,2025-05-02
AAPL,Apple Dealt Stinging Court Defeat on App Store Sales Commissions,2025-05-02
AAPL,"Apple Violated Antitrust Ruling, Judge Finds",2025-05-02
AAPL,Apple Inc. (AAPL): Tariffs Force a Price Target Cut — Can Services and AI Keep It Afloat?,2025-05-02
AAPL,Apple Faces Potential Criminal Contempt Charge in U.S. Antitrust Case,2025-05-02
AAPL,Epic Games just scored a major win against Apple,2025-05-02
AAPL,Court sides with Fortnite maker Epic as Apple sanctioned for defying order in App Store case,2025-05-02
AAPL,"Apple must halt non-App Store sales commissions, judge says",2025-05-02
AAPL,Is Apple Inc. (AAPL) the Best Augmented Reality Stock to Buy According to Hedge Funds?,2025-05-02
AAPL,US judge rules Apple violated order to reform App Store,2025-05-02
AAPL,"Amazon and Apple earnings coverage, Eli Lilly: What to Watch",2025-05-02
AAPL,Apple Stock Gets Price-Target Cuts On Tariff Headwinds,2025-05-02
AAPL,Amazon plans to build dozens of US warehouses in rural expansion,2025-05-02
AAPL,Apple Must Explain How It Can Dodge a Trade War as It Reports Earnings,2025-05-02
AAPL,Veteran Investor Joe Terranova Is “Concerned” About Apple Inc. (AAPL),2025-05-02
AAPL,20 company reactions — good and bad — to Trump’s tariff war,2025-05-02
AAPL,Big Tech Civil War: Meta and Spotify Just Declared War on Apple and Google,2025-05-02
AAPL,Is Apple Inc. (AAPL) the Best Dow Stock for the Next 12 Months?,2025-05-02
AAPL,Google CEO warns judge a breakup of search empire 'will have many unintended consequences',2025-05-02
AAPL,Market Chatter: Google's Pichai Expects to Reach Deal With Apple on Including Gemini on New Phones This Year,2025-05-02
AAPL,"Pichai pushes back on antitrust remedies, hints at Apple Gemini talks",2025-05-01
AAPL,"AAPL, NVDA Aren’t Safe Investments Now, Renowned Analyst Suggests",2025-05-01
AAPL,Is Apple (AAPL) a 'Buy' Ahead of Q2 Earnings Announcement?,2025-05-01
AAPL,Apple ETFs in Focus Ahead of Fiscal Q2 Earnings,2025-05-01
AAPL,Will Strong Services Offset Weak iPhone Sales for AAPL's Q2 Earnings?,2025-05-01
AAPL,Apple & Amazon Earnings: What Can Investors Expect?,2025-05-01
AAPL,"Magnificent 7 Earnings: What to Expect (AMZN, AAPL, META and MSFT)",2025-05-01
AAPL,US tariffs: Landscape for device OEMs is fraught with uncertainty,2025-05-01
AAPL,Why Big Tech may be set for a surprise rebound through MAGMAN,2025-05-01
AAPL,Prediction: 1 Stock That'll Be Worth More Than Apple a Year From Now,2025-05-01
AAPL,Is Apple Inc. (AAPL) Among The Best Warren Buffett Stock Picks For Beginners?,2025-05-01
AAPL,Apple earnings are coming. Here's what to watch,2025-05-01
IBM,IBM Plans to Invest $150 Billion. Time to Buy the Stock?,2025-05-03
IBM,IBM and Box partner on enterprise AI for businesses,2025-05-03
IBM,International Business Machines (NYSE:IBM) Advances Tax AI Solutions With EY.ai Collaboration,2025-05-03
IBM,Prediction: 3 Quantum Computing Stocks That Will Be Worth More Than IonQ 10 Years From Now,2025-05-03
IBM,2 Artificial Intelligence Stocks to Buy in May,2025-05-03
IBM,International Business Machines (IBM): Jim Cramer Is Straightforward – “Many Reasons” To Buy,2025-05-03
IBM,IBM and the EY organization debut artificial intelligence-powered global tax compliance solutions,2025-05-03
IBM,IBM Extends Microsoft Collaboration: Will the Stock Benefit?,2025-05-02
IBM,Is International Business Machines Corporation (IBM) the Best Dow Stock for the Next 12 Months?,2025-05-02
IBM,IBM and Scuderia Ferrari HP Debut Reimagined Mobile App to Supercharge Global Formula 1 Fan Experience,2025-05-02
IBM,International Business Machines Corporation (IBM): $150 Billion U.S. Investment Signals Quantum and AI Expansion,2025-05-02
IBM,International Business Machines Corporation (IBM): Jim Cramer Still Likes It — Even After the Selloff,2025-05-02
IBM,"RTX, IBM In Race for Contract to Upgrade US Air Traffic Control System, Trump Says",2025-05-02
IBM,International Business Machines (NYSE:IBM) Expands AI And Cloud Partnerships With New Initiatives,2025-05-02
IBM,"Trump says IBM, Raytheon may get US contract to modernize air traffic control system",2025-05-01
IBM,BNP Paribas extends alliance with IBM Cloud,2025-05-01
IBM,IBM unveils Microsoft Practice to advance digital transformation,2025-05-01
IBM,"IBM to invest $150B in US manufacturing, R&D",2025-05-01
IBM,IBM Just Boosted Its Dividend. Is It Time to Buy?,2025-05-01
IBM,Grid Dynamics (GDYN) Reports Earnings Tomorrow: What To Expect,2025-05-01
IBM,Earnings To Watch: Xerox (XRX) Reports Q1 Results Tomorrow,2025-05-01
IBM,International Business Machines (NYSE:IBM) Expands AI & Cloud Offerings With US$150 Billion Investment,2025-05-01
IBM,Box and IBM Partner to Bring New Enterprise-Level AI Models to Support Content Generation and Productivity,2025-05-01
IBM,IBM to Invest Billions in American Manufacturing,2025-04-30
IBM,International Business Machines Corporation (IBM) is Attracting Investor Attention: Here is What You Should Know,2025-04-30
IBM,IBM Launches Microsoft Practice to Deliver Transformative Business Value for Clients,2025-04-30
IBM,Why Trump’s Next 100 Days Will Be More Crucial for Stock Markets and 5 Other Things to Know Today.,2025-04-30
IBM,IBM plans $150bn investment in US over next five years,2025-04-30
IBM,What an Alphabet Breakup Would Mean for Shareholders,2025-04-30
IBM,Stocks Rise in Final Hour of Wall Street Trading: Markets Wrap,2025-04-30
IBM,IBM is supercharging its quantum computer efforts as part of a major 5-year investment in U.S. tech,2025-04-30
IBM,IBM's Plans to Invest Billions in the US,2025-04-30
IBM,"IBM Delivers Strong Quarter, Eases Concerns Over Government Cuts",2025-04-30
IBM,Top Midday Stories: IBM Plans to Invest $150 Billion in US Over 5 Years; Sabre to Sell Hospitality Solutions Unit to TPG for $1.1 Billion,2025-04-29
IBM,IBM Plans $150 Billion US Investment to Boost Computer Manufacturing,2025-04-29
IBM,"IBM Pledges $150 Billion U.S. Investment, Including Quantum Push",2025-04-29
IBM,IBM says it will invest $150 billion in the U.S. over 5 years,2025-04-29
IBM,IBM to Invest $150 Billion in US Over Next Five Years,2025-04-29
IBM,IBM Vows to Make Quantum Computers in U.S. and Plans $150 Billion in Domestic Investment,2025-04-29
IBM,"IBM, Apple, Eli Lilly: Tracking Corporate Spending Pledges Under Trump",2025-04-29
IBM,"Nvidia vs Huawei, Domino's Q1 miss, IBM's $150B US investing plan",2025-04-29
IBM,IBM latest tech firm to invest in U.S. with $150 billion commitment,2025-04-29
IBM,Is ACI Worldwide (ACIW) Outperforming Other Computer and Technology Stocks This Year?,2025-04-29
IBM,IBM to Invest $150B in US Over Next Five Years,2025-04-29
IBM,"IBM pledges $150B toward US-based manufacturing, research",2025-04-29
IBM,IBM Delivers Autonomous Security Operations with Cutting-Edge Agentic AI,2025-04-29
IBM,IBM to invest $150 billion in US over next five years to aid quantum push,2025-04-29
IBM,IBM announces $150B investment in US,2025-04-29
IBM,IBM Unveils $150 Billion Investment in America to Accelerate Technology Opportunity,2025-04-29
IBM,"IBM Q1 Earnings Call: AI, Software, and Productivity Initiatives Drive Outperformance",2025-04-28
IBM,Analysts reboot IBM stock price targets after earnings,2025-04-27
IBM,Okta Declines 11% in a Month: Should You Buy the Stock on the Dip?,2025-04-27
IBM,International Business Machines (IBM): Among the Growing Dividend Stocks with Low PE Ratios,2025-04-26
IBM,IBM Is Back. Now It Must Prove Its Mettle in AI.,2025-04-26
IBM,Why Did IBM Stock Tumble After an Earnings Beat?,2025-04-26
IBM,Buy the Dip in IBM Stock After Q1 Earnings?,2025-04-26
IBM,"Stocks to Watch Recap: Alphabet, Intel, P&G, Merck",2025-04-26
IBM,"These Stocks Moved the Most Today: Tesla, IBM, ServiceNow, Texas Instruments, Newmont, Southwest Airlines, and More",2025-04-26
IBM,IBM Stock Falls. Earnings Just Weren’t Strong Enough.,2025-04-26
IBM,IBM Tumbles as Software Segment Stumbles in Q1,2025-04-26
IBM,Why IBM (IBM) Shares Are Getting Obliterated Today,2025-04-26
IBM,IBM Earnings Underwhelm Investors,2025-04-26
IBM,International Business Machines (NYSE:IBM) Reports Q1 Revenue Growth But Decline In Net Income,2025-04-26
IBM,Why IBM Stock Is Sinking Today,2025-04-25
IBM,IBM Stock Slides Despite Q1 Earnings Beat: Time to Buy Its ETFs?,2025-04-25
IBM,"Top Stock Movers Now: ServiceNow, Hasbro, IBM, and More",2025-04-25
IBM,"IBM earnings, PepsiCo guidance lowered, airline guidance pulled",2025-04-25
IBM,IBM stock falls after results reveal US government contracts canceled by DOGE,2025-04-26
IBM,Trump Trade: Trump considers cutting tariffs on Chinese imports,2025-04-25
IBM,"IBM Warns Economic Conditions, Government Cuts May Cause a Spending Pullback",2025-04-25
IBM,Top Cloud Computing Stocks to Bet on for Healthy Returns,2025-04-25
IBM,IBM Tanks 6.8%--But Its $6B AI Engine Might Be the Real Story,2025-04-25
IBM,How to Find Strong Computer and Technology Stocks Slated for Positive Earnings Surprises,2025-04-25
IBM,IBM Q1 Earnings & Revenues Beat Estimates on Solid Demand Trend,2025-04-25
IBM,IBM touts software segment gains as infrastructure revenue falls,2025-04-25
IBM,"IBM price, Q1 earnings: Stock sinks 6% after news that Elon Musk’s DOGE cuts thwarted 15 government contracts",2025-04-25
IBM,Q1 2025 International Business Machines Corp Earnings Call,2025-04-25
IBM,IBM Stock Tumbles 7% After Q1 Segment Weakness Overshadows Guidance,2025-04-25
IBM,5 Things to Know Before the Stock Market Opens,2025-04-25
IBM,Stock Swings Worsen as China Pushes Back Over Tariffs and 5 Other Things to Know Today.,2025-04-25
IBM,"IBM slides as federal spending cuts, uncertain economy impact consulting business",2025-04-25
IBM,"Social Buzz: Wallstreetbets Stocks Mostly Lower Pre-Bell Thursday; IBM to Decline, ServiceNow to Advance",2025-04-25
IBM,"Trending tickers: Tesla, IBM, Boeing, Unilever and Asos",2025-04-25
IBM,"IBM Plays Down Trump Tariff Concerns: DOGE Could Affect Consulting Business, But Its 'US Federal Business Is Less Than 5%,' Says CEO",2025-04-25
IBM,International Business Machines Corp (IBM) Q1 2025 Earnings Call Highlights: Strong Software ...,2025-04-25
IBM,"Markets in Green 2nd Straight Day; Q1 Reports for CMG, IBM & More",2025-04-25
IBM,IBM (IBM) Reports Q1 Earnings: What Key Metrics Have to Say,2025-04-25
IBM,Is International Business Machines Corporation (IBM) the Best Stock to Buy and Hold for 20 Years?,2025-04-25
IBM,IBM (IBM) Tops Q1 Earnings and Revenue Estimates,2025-04-25
IBM,"IBM Earnings Decline, Revenue Rises on Software Gains",2025-04-25
IBM,"IBM’s (NYSE:IBM) Q1: Beats On Revenue, Guides for Strong Sales Next Quarter",2025-04-25
IBM,"IBM Set to Benefit From Focus on AI, Automation as Clients Seek Efficiency in Uncertain Economy, CFO Says",2025-04-25
IBM,"IBM earnings top estimates, issues upbeat Q2 revenue outlook",2025-04-25
IBM,"IBM Stock Falls Despite Earnings Beat. Here's What The Tech Giant Said About DOGE, Tariffs.",2025-04-25
IBM,IBM: Q1 Earnings Snapshot,2025-04-25
IBM,"IBM says 15 contracts impacted by DOGE cost cuts, shares drop",2025-04-25
IBM,IBM RELEASES FIRST-QUARTER RESULTS,2025-04-25
IBM,"IBM Is “Well-Positioned to Benefit From AI,” Expert Says",2025-04-24
IBM,SAP Stock Soars After Company Reiterates Guidance. CFO Says Economic Backdrop Is ‘Anything But Easy.’,2025-04-24
IBM,"Google, Tesla, Boeing, IBM: Stocks to watch today",2025-04-24
IBM,Tech giants to plow $500 billion cash hoard into more buybacks,2025-04-24
IBM,"Trending tickers: Tesla, Intel, Robinhood, Fresnillo and Reckitt Benckiser",2025-04-24
IBM,"Sec. Bessent speech, Boeing earnings, housing data: What to Watch",2025-04-24
IBM,Will Solid Software Revenues Boost IBM's Q1 Earnings Results?,2025-04-23
IBM,"European Space Agency, IBM unveil TerraMind AI to enhance Earth observation",2025-04-23
IBM,"IBM Expected to Deliver In-Line Q1 Results, Morgan Stanley Says",2025-04-23
IBM,"IBM Earnings On Deck. AI Push, 'Safe-Haven' Status, DOGE Cuts In Focus.",2025-04-23
IBM,Will Lower Consulting Revenues Affect IBM's Q1 Earnings Results?,2025-04-23
IBM,IBM (IBM) Reports Q1: Everything You Need To Know Ahead Of Earnings,2025-04-23
IBM,A look back at corporate giants that have been broken up by the government,2025-04-23
IBM,Jim Cramer Likes International Business Machines Corporation (IBM) for Reliability,2025-04-23
IBM,IBM's Q1 Earnings on the Horizon: How to Play the Stock Now?,2025-04-22
