company,title,published_date
TSLA,"Tesla stock higher as robotaxi 'golden age' begins with June 12 start date, Musk officially departing D.C.",2025-05-29
TSLA,"Stock Market Today: A choppy stock day; a tweet on China; inflation cools; Nvidia, Tesla, Palantir",2025-05-30
TSLA,"Tesla Heads For Winning Week, Second Straight Winning Month as Musk Leaves DOGE",2025-05-30
TSLA,EV tax credit elimination: What it could mean for Tesla and the US auto industry if it ends,2025-05-30
TSLA,ETFs to Ride on Tesla's Renewed Growth Story,2025-05-30
TSLA,Musk and Trump Meet in The Oval Office Today. What to Watch.,2025-05-30
TSLA,Tesla Stock Is Dropping. Why It Can’t Spoil a Wonderful May.,2025-05-30
TSLA,"Ackman, Druckenmiller-Tracking ETFs Are Latest Industry Gambit",2025-05-30
TSLA,Notable open interest changes for May 29th,2025-05-30
TSLA,Can Tesla sales recover in Europe amid Elon Musk backlash? Yahoo Finance readers have their say,2025-05-30
TSLA,"Tesla's Optimus May Be The First Humanoid Robot To Achieve High Volume And Tech Scale, Says Nvidia CEO Jensen Huang: '... Likely To Be The Next Multi-Trillion Dollar Industry'",2025-05-30
TSLA,"Why Elon Musk needs Tesla more than ever? Humanoid, BYD and much more on Tesla",2025-05-30
TSLA,Electric Vehicles Update - Racing Ahead Ultra-Fast Batteries Drive Future Growth,2025-05-30
TSLA,Tesla to begin driverless Model Y deliveries in Austin this June,2025-05-30
TSLA,"Tesla shareholders beg for Elon Musk to focus on the company, asking the CEO to work at least 40 hours a week",2025-05-30
TSLA,"Zacks Investment Ideas feature highlights: NVIDIA, Meta Platforms and Tesla",2025-05-30
MSFT,Why Is Microsoft (MSFT) Up 7.8% Since Last Earnings Report?,2025-05-30
MSFT,Marvell Stock Slides. Why It Could Be the Cheap AI Chip Play.,2025-05-30
MSFT,"Tevogen Details its Artificial Intelligence Initiative, Tevogen.AI; Proprietary AI-Powered Immunotherapy with Microsoft and Databricks Partnerships",2025-05-30
MSFT,"Microsoft unit in Russia to file for bankruptcy, database shows",2025-05-30
MSFT,Nvidia Stock Slips. Why It Might Be Entering Its ‘Apple Era’.,2025-05-30
MSFT,2 Unstoppable Vanguard ETFs That Have Doubled in Just 5 Years,2025-05-30
MSFT,Microsoft Corporation (MSFT) is Attracting Investor Attention: Here is What You Should Know,2025-05-30
MSFT,"Microsoft Secures Massive Copilot Deal, Barclays Bets Big on AI Surge",2025-05-30
MSFT,"Warren Buffett Thinks This Is a Particularly ""Fabulous"" Kind of Business",2025-05-30
MSFT,"OpenAI risks being undercut by cheaper rivals, says star investor",2025-05-30
MSFT,3 USA-Based Stocks That Can Be Great Buys Amid Tariff Risks,2025-05-30
MSFT,Billionaire Chase Coleman Just Loaded Up on 4 Brilliant AI Stocks,2025-05-30
MSFT,1 Magnificent Vanguard ETF to Confidently Buy With $600 During the Stock Market Rebound,2025-05-30
NVDA,"Chip stocks slide, Palantir govt. contract, Costco Q3 earnings",2025-05-30
NVDA,How this Nvidia rival is trying to take chunks of its market share,2025-05-30
NVDA,Nvidia's loss in China is also a bargaining chip,2025-05-30
NVDA,Wall Street is looking past Nvidia’s China problem… for now,2025-05-29
NVDA,"Nvidia stands to lose billions, thanks to new Trump policy",2025-05-30
NVDA,Better AI Stock: Alphabet vs. Nvidia,2025-05-30
NVDA,"Stock Market Rallies Amid Trump Tariff News, Nvidia, But Also Faces Resistance: Weekly Review",2025-05-30
NVDA,Nvidia Falters. Powering Robots That Fold Laundry Is Still A Pipedream. Is Nvidia A Buy Or Sell Now?,2025-05-30
NVDA,Nvidia and Dell Team Up to Build Department of Energy Supercomputer,2025-05-30
NVDA,"These Stocks Are Moving the Most Today: Nvidia, Dell, Ulta, Gap, Marvell, American Eagle, and More",2025-05-30
NVDA,Nvidia (NVDA) Gets Wall Street Boost on Strong Q1 Results and Upbeat Guidance,2025-05-30
NVDA,Why Navitas Followed Last Week's Monster Gain With Another This Week,2025-05-30
NVDA,Update: Market Chatter: Chinese Tech Giants Turn to Local AI Chips Instead of Nvidia Due to US Restrictions,2025-05-30
NVDA,"Morning Movers: Stocks jump as court blocks tariffs, Nvidia strong again",2025-05-30
AAPL,Elon Musk's renewed 'laser focus' on Tesla is his 'redemption arc',2025-05-30
AAPL,"Judge Weighs Big Changes to Google, Including Breakup, AI Limits",2025-05-30
AAPL,US Smartphone Manufacturing Is a 'Dream': IDC's Popal,2025-05-30
AAPL,Apple Rebound Likely as Court Blocks Tariff Sell-Off Catalyst,2025-05-30
AAPL,"Appeals Court Rescues Trump Tariffs On China, Apple And The World; S&P 500 Rises",2025-05-30
AAPL,Jim Cramer on Apple Inc. (AAPL): “They’ll Have the Best AI”,2025-05-30
AAPL,"Apple Plans OS Rebrand, Its Biggest Ever",2025-05-30
AAPL,Apple's App Store Billings Triple to $406 Billion in Five Years,2025-05-30
AAPL,Apple Dips as IDC Cuts Smartphone Forecast,2025-05-30
AAPL,"iPhone Shipments Still Set to Grow Despite Tariffs, Research Firm Says",2025-05-30
AAPL,UBS Reiterates Neutral on Apple (AAPL) as Tariff Talk Sparks iPhone Buying Surge,2025-05-30
AAPL,Evercore Unfazed: $205 Target Reaffirmed Despite GOOG Underperformance,2025-05-30
IBM,IBM (IBM) Stock Falls Amid Market Uptick: What Investors Need to Know,2025-05-30
IBM,Deutsche Bank Extends IBM Partnership to Enhance Technology Infrastructure,2025-05-30
IBM,"IBM's TP Software Stays 'Extremely Relevant' To Growth, Even In The Public Cloud Age: Analyst",2025-05-30
IBM,Why Is Seagate (STX) Up 28.9% Since Last Earnings Report?,2025-05-30
IBM,"Salesforce delivers an earnings surprise, but bears on the stock still lurk: What Wall Street is saying",2025-05-30
IBM,Nvidia and CEO Jensen Huang get a pass for an earnings whiff: What Wall Street is saying,2025-05-30
TSLA,Elon Musk is not leaving Washington quietly,2025-05-30
TSLA,Elon Musk departs from Trump admin. What's next for the Tesla CEO?,2025-05-30
TSLA,"Trump Says He Is Having Elon Musk Over At The White House Tomorrow For A Press Conference As Billionaire Exits Government: 'This Will Be His Last Day, But Not Really...'",2025-05-30
TSLA,"The Score: E.l.f. Beauty, Tesla, Nvidia, and More Stocks That Defined the Week",2025-05-30
TSLA,Tesla Stock Ends a Wonderful May With a Loss,2025-05-30
TSLA,What’s Next for Elon Musk After DOGE?,2025-05-30
TSLA,"Trump says automakers, Tesla must build cars, parts in US",2025-05-30
TSLA,Musk Takes One Last Shot at Democrats From the Oval Office Before Walking Away From DOGE,2025-05-30
TSLA,Elon Musk’s Court Fights to Outlast His Time in the White House,2025-05-30
TSLA,Trump Says He Wants Americans to Buy U.S.-Built Cars,2025-05-30
TSLA,Musk on Leaving White House: ‘DOGE Influence Will Only Grow Stronger’,2025-05-30
TSLA,Uber Stock Dropped on Fears of Tesla’s Robotaxi. It’s Time to Buy.,2025-05-30
TSLA,Trump Explodes Over China Deal Breach -- Rare Earths and Tariffs Back on the Table,2025-05-30
TSLA,"Tesla Stock Logs Weekly Gains, Second Straight Winning Month as Musk Leaves DOGE",2025-05-30
MSFT,Is Nvidia's Deal With OpenAI a Game Changer?,2025-05-30
MSFT,"OpenAI Secures $11.6B For Texas Data Center Expansion, Reducing Microsoft Dependence",2025-05-30
MSFT,LinkedIn cuts 281 workers in California as tech layoffs continue,2025-05-30
MSFT,"ServiceNow Regenerates On Swarm Of AI Deals With Amazon, Microsoft And More",2025-05-30
MSFT,Sector Update: Tech Stocks Fall Late Afternoon,2025-05-30
NVDA,Nvidia stock falls as Trump says China 'violated' trade deal with US,2025-05-30
NVDA,Why Nvidia Stock Dropped to End the Week,2025-05-30
NVDA,Defensive Sectors Help Push US Equity Indexes Higher This Week Amid Uncertainty Over Trade Tariffs,2025-05-30
NVDA,"These Stocks Moved the Most Today: Nvidia, Dell, Ulta, Gap, Marvell, Regeneron, and More",2025-05-30
NVDA,"Nvidia, Other Chip Stocks Slide Amid Worries About US-China Trade Tensions",2025-05-30
NVDA,Super Micro's Stock Slumps Even as NVIDIA Tie-Up Heats Up,2025-05-30
NVDA,Analyst resets Nvidia stock price target after CEO slams U.S. chip policy,2025-05-30
NVDA,"Six Tech Stocks to Buy—and What to Avoid, According to an Analyst",2025-05-30
AAPL,Apple's difficult 2025 is Tim Cook's biggest test yet,2025-05-31
AAPL,Best Stock to Buy Right Now: Apple vs. Chipotle,2025-05-31
AAPL,Where the Stock Market Stands Now After a Wild Start to the Year,2025-05-31
AAPL,47% of Berkshire Hathaway's $276 Billion Warren Buffett-Led Portfolio Is Invested in 3 Dividend Stocks,2025-05-31
AAPL,These Are Stocks You Should Watch in June,2025-05-31
AAPL,"Warren Buffett Holds Apple Stock Despite Tariffs and Buys a Restaurant Stock Up 4,500% in 15 Years",2025-05-31
AAPL,Trump’s trade war is bruising Apple — and your 401(k),2025-05-31
AAPL,"Judge Weighs Big Changes to Google, Including Breakup, AI Limits",2025-05-31
AAPL,US Smartphone Manufacturing Is a 'Dream': IDC's Popal,2025-05-31
AAPL,Elon Musk's renewed 'laser focus' on Tesla is his 'redemption arc',2025-05-31
AAPL,Apple Rebound Likely as Court Blocks Tariff Sell-Off Catalyst,2025-05-31
AAPL,The fate of Google's search empire is now up to a judge,2025-05-31
AAPL,4 Dividend-Paying Dow Jones Growth Stocks to Buy in June and Hold for Decades,2025-05-31
AAPL,Apple Sees Small Rebound in China Shipments,2025-05-31
AAPL,Latest News In Cloud AI - AI Market Transformation Drives Growth and Innovation,2025-05-31
AAPL,Mag 7 valuations before & after Nvidia earnings: Chart of the Day,2025-05-31
AAPL,Foreign-branded mobile phone sales in China edge up in April,2025-05-31
AAPL,Smartphone Sales Growth Hit by Tariff ‘Whirlwind of Uncertainty’,2025-05-31
AAPL,"Elon Musk Thinks Tesla Will Be the World's Most Valuable Company, but This Huge Problem Could Send Its Stock Plunging by 70% Instead",2025-05-31
AAPL,Apple (AAPL) Rated Hold by Loop Capital Amid Tariff and iPhone 17 Buzz,2025-05-31
IBM,IonQ vs. Microsoft: Which Quantum Cloud Stock Is the Better Buy Today?,2025-05-31
TSLA,Elon Musk is not leaving Washington quietly,2025-05-31
TSLA,Nvidia's auto biz surged last quarter. CEO Jensen Huang says it's a multitrillion-dollar opportunity.,2025-05-31
TSLA,Prediction: Tesla Stock Is a Buy Before July 23,2025-05-31
TSLA,"Tesla's robotaxi rollout is alarming the public, new report shows",2025-05-31
TSLA,Elon Musk Says Humanoid Robots Will Start Impacting Countries' GDPs In 4 To 5 Years. 'Robot Cars' Even Sooner—In Just 1 To 2 Years,2025-05-31
TSLA,Elon Musk's return drives Tesla stock surge in May,2025-05-31
TSLA,"Tourism's perfect storm, Walmart and Costco's gas stations, and Musk leaves DOGE: Business news roundup",2025-05-31
TSLA,The Weekend: Food inflation dampens hopes of a rate cut as tariff twists and turns continue,2025-05-31
TSLA,China Schools the West on EVs,2025-05-31
TSLA,"Trump Says He Is Having Elon Musk Over At The White House Tomorrow For A Press Conference As Billionaire Exits Government: 'This Will Be His Last Day, But Not Really...'",2025-05-31
TSLA,"The Score: E.l.f. Beauty, Tesla, Nvidia, and More Stocks That Defined the Week",2025-05-31
TSLA,Tesla Stock Ends a Wonderful May With a Loss,2025-05-31
TSLA,What’s Next for Elon Musk After DOGE?,2025-05-31
TSLA,"Trump says automakers, Tesla must build cars, parts in US",2025-05-31
TSLA,Elon Musk leaves his official role in Trump’s White House—but not really,2025-05-31
TSLA,Musk Takes One Last Shot at Democrats From the Oval Office Before Walking Away From DOGE,2025-05-31
TSLA,Tesla stock notches weekly gain as Musk bashes New York Times report on way out of Trump White House,2025-05-31
MSFT,"Move Over FAANG, Enter the TACO Trade: This Monster ETF Could Be Poised to Take Off",2025-05-31
MSFT,3 Stocks to Buy to Ride the Nuclear Power Renaissance,2025-05-31
MSFT,"The Smartest Growth Stock to Buy With $5,000 Right Now",2025-05-31
MSFT,Is Nvidia's Deal With OpenAI a Game Changer?,2025-05-31
MSFT,"OpenAI Secures $11.6B For Texas Data Center Expansion, Reducing Microsoft Dependence",2025-05-31
MSFT,LinkedIn cuts 281 workers in California as tech layoffs continue,2025-05-31
MSFT,"ServiceNow Regenerates On Swarm Of AI Deals With Amazon, Microsoft And More",2025-05-31
MSFT,Sector Update: Tech Stocks Fall Late Afternoon,2025-05-31
MSFT,Why Is Microsoft (MSFT) Up 7.8% Since Last Earnings Report?,2025-05-31
MSFT,Marvell Stock Slides. Why It Could Be the Cheap AI Chip Play.,2025-05-31
MSFT,"Tevogen Details its Artificial Intelligence Initiative, Tevogen.AI; Proprietary AI-Powered Immunotherapy with Microsoft and Databricks Partnerships",2025-05-31
MSFT,"Microsoft unit in Russia to file for bankruptcy, database shows",2025-05-31
MSFT,Nvidia Stock Slips. Why It Might Be Entering Its ‘Apple Era’.,2025-05-31
MSFT,2 Unstoppable Vanguard ETFs That Have Doubled in Just 5 Years,2025-05-31
MSFT,Microsoft Corporation (MSFT) is Attracting Investor Attention: Here is What You Should Know,2025-05-31
NVDA,Jensen Huang Just Delivered a Startling Message About Nvidia's Future in China,2025-05-31
NVDA,"NVIDIA First Quarter 2026 Earnings: Revenues Beat Expectations, EPS Lags",2025-05-31
NVDA,"Nvidia can't be stopped, Apple falls behind, and the AI data center race: Tech news roundup",2025-05-31
NVDA,"Can AMD Stock Turn a $25,000 Investment Into $1 Million by the Time You Retire?",2025-05-31
NVDA,Charting the Global Economy: US GDP Falls on Larger Trade Hit,2025-05-31
NVDA,The U.S. Plan to Hobble China Tech Isn’t Working,2025-05-31
NVDA,Why Nvidia Stock Dropped to End the Week,2025-05-31
NVDA,Defensive Sectors Help Push US Equity Indexes Higher This Week Amid Uncertainty Over Trade Tariffs,2025-05-31
NVDA,"These Stocks Moved the Most Today: Nvidia, Dell, Ulta, Gap, Marvell, Regeneron, and More",2025-05-31
NVDA,"Nvidia, Other Chip Stocks Slide Amid Worries About US-China Trade Tensions",2025-05-31
NVDA,Super Micro's Stock Slumps Even as NVIDIA Tie-Up Heats Up,2025-05-31
NVDA,Analyst resets Nvidia stock price target after CEO slams U.S. chip policy,2025-05-31
NVDA,"Chip stocks slide, Palantir govt. contract, Costco Q3 earnings",2025-05-31
NVDA,"Six Tech Stocks to Buy—and What to Avoid, According to an Analyst",2025-05-31
AAPL,"Stock market today: Dow, S&P 500, Nasdaq futures slip as Wall Street kicks off June after bullish May",2025-06-02
AAPL,Samsung Nears Wide-Ranging Deal With Perplexity for AI Features,2025-06-01
AAPL,Apple Stock: Did President Trump Just Give Investors a Reason to Sell?,2025-06-01
AAPL,Will Apple Reclaim Its Title as the Largest Company in the World by Market Cap? The Answer May Surprise You.,2025-06-01
AAPL,"Taser Boss Tops Ranking of Highest-Paid CEOs, With $165 Million. Here’s the List.",2025-06-01
AAPL,Best Stock to Buy Right Now: Apple vs. Chipotle,2025-06-01
AAPL,Where the Stock Market Stands Now After a Wild Start to the Year,2025-06-01
AAPL,47% of Berkshire Hathaway's $276 Billion Warren Buffett-Led Portfolio Is Invested in 3 Dividend Stocks,2025-06-01
AAPL,These Are Stocks You Should Watch in June,2025-06-01
AAPL,"Shimmers, floating toolbars, and radical transparency: Here’s what iOS 26 could look like",2025-06-01
AAPL,"Warren Buffett Holds Apple Stock Despite Tariffs and Buys a Restaurant Stock Up 4,500% in 15 Years",2025-06-01
AAPL,Trump’s trade war is bruising Apple — and your 401(k),2025-06-01
TSLA,Will Tesla have to play catch up to Waymo's robotaxis?,2025-06-01
TSLA,Chinese EV Makers Pull Away From Tesla With Sales Gains,2025-06-01
TSLA,"Jensen Huang Praised Tesla, Said Every Car Will Need Autonomous Capability—'It's Safer, It's More Convenient, It's 'More Fun To Drive'",2025-06-01
TSLA,Big Tech is back in S&P 500 driver’s seat as profit engines hum,2025-06-01
TSLA,'Bitcoin Has Never Been More Important': Bitwise CEO Reacts To Elon Musk's Call To Accelerate GDP Growth,2025-06-01
TSLA,Is Lucid Group Stock Your Ticket to Becoming a Millionaire?,2025-06-01
TSLA,Prediction: Tesla Stock Is a Buy Before July 23,2025-06-01
TSLA,"Tesla's robotaxi rollout is alarming the public, new report shows",2025-06-01
TSLA,Elon Musk Says Humanoid Robots Will Start Impacting Countries' GDPs In 4 To 5 Years. 'Robot Cars' Even Sooner—In Just 1 To 2 Years,2025-06-01
TSLA,Elon Musk's return drives Tesla stock surge in May,2025-06-01
TSLA,Nvidia's auto biz surged last quarter. CEO Jensen Huang says it's a multitrillion-dollar opportunity.,2025-06-01
TSLA,"Tourism's perfect storm, Walmart and Costco's gas stations, and Musk leaves DOGE: Business news roundup",2025-06-01
TSLA,The Weekend: Food inflation dampens hopes of a rate cut as tariff twists and turns continue,2025-06-01
MSFT,Nvidia CEO Jensen Huang Just Delivered Incredible News for Amazon Investors,2025-06-01
MSFT,"Billionaire David Tepper Bought More Shares of This Artificial Intelligence (AI) Stock That Could Join Apple, Microsoft, and Nvidia in the $3 Trillion Club by 2030",2025-06-01
MSFT,1 No-Brainer Artificial Intelligence (AI) ETF to Buy With $50 During the S&P 500 Bull Market,2025-06-01
MSFT,"Move Over FAANG, Enter the TACO Trade: This Monster ETF Could Be Poised to Take Off",2025-06-01
MSFT,3 Stocks to Buy to Ride the Nuclear Power Renaissance,2025-06-01
MSFT,"The Smartest Growth Stock to Buy With $5,000 Right Now",2025-06-01
NVDA,What Wall Street might be missing on Nvidia,2025-06-01
NVDA,Is Nvidia a Buy?,2025-06-01
NVDA,Is Nvidia Stock a Buy Now?,2025-06-01
NVDA,Jim Cramer and Wall Street Are Bullish on NVIDIA (NVDA),2025-06-01
NVDA,Broadcom earnings may produce shock and awe,2025-06-01
NVDA,Prediction: Nvidia Stock Will Soar in 2025 (and It's Due to This 1 Number),2025-06-01
NVDA,2 AI Stocks to Buy in June,2025-06-01
NVDA,2 No-Brainer Artificial Intelligence (AI) Stocks to Buy Hand Over Fist During the TACO Trade,2025-06-01
NVDA,3 Stocks Set to Ride the Artificial Intelligence (AI) Wave to New Heights,2025-06-01
NVDA,Prediction: This Artificial Intelligence (AI) Company Will Be Worth Over $5 Trillion in 10 Years,2025-06-01
NVDA,5 Brilliant Stocks to Buy in June,2025-06-01
NVDA,"Nvidia's Q1 Results Were Great, but This AI Stock Could Be a Bigger Winner",2025-06-01
NVDA,3 Top Tech Stocks to Buy in June,2025-06-01
NVDA,2 Top Tech Stocks That Can Double by 2030,2025-06-01
AAPL,S&P 500's breakout May was largely a result of Mag 7 gains,2025-06-02
AAPL,Apple Appeals EU's Interoperability Mandate,2025-06-02
AAPL,Apple WWDC Is Coming. What ‘Low Investor Expectations’ Mean for the Stock.,2025-06-02
AAPL,The Magnificent Seven Stocks Staged a Blistering May Rally. What's Next?,2025-06-02
AAPL,"Apple Stock Has ‘Significant,’ Long-Term Opportunities. The Case for Buying Now.",2025-06-02
AAPL,Apple challenges 'unreasonable' EU order to open up to rivals,2025-06-02
AAPL,Market Chatter: Apple Challenging EU Order to Improve Compatibility With Other Firms' Products,2025-06-02
AAPL,Are Hedge Funds Warming Up To Google Stock Amid Magnificent Seven Upheaval?,2025-06-02
AAPL,Apple Challenges EU Order to Increase Compatibility with Rivals’ Products,2025-06-02
AAPL,"Apple (AAPL) Could Gain From Tariff Shake-Up, iPhone and AI Bets Drive Optimism",2025-06-02
AAPL,3 Tech Stocks You Can Buy and Hold for the Next Decade,2025-06-02
AAPL,Samsung Nears Wide-Ranging Deal With Perplexity for AI Features,2025-06-02
AAPL,Apple Stock: Did President Trump Just Give Investors a Reason to Sell?,2025-06-02
AAPL,Big Tech Is Back in S&P 500 Driver’s Seat as Profit Engines Hum,2025-06-02
AAPL,Will Apple Reclaim Its Title as the Largest Company in the World by Market Cap? The Answer May Surprise You.,2025-06-02
AAPL,"Taser Boss Tops Ranking of Highest-Paid CEOs, With $165 Million. Here’s the List.",2025-06-02
IBM,"IBM acquires data analysis startup Seek AI, opens AI accelerator in NYC",2025-06-02
IBM,"IBM Unveils watsonx AI Labs: The Ultimate Accelerator for AI Builders, Startups and Enterprises in New York City",2025-06-02
IBM,IT Services & Consulting Stocks Q1 Teardown: IBM (NYSE:IBM) Vs The Rest,2025-06-02
TSLA,"Rivian’s R2 will 'underpin' all future Volkswagen EVs, exec says",2025-06-02
TSLA,"Tesla EU sales, FDA & Moderna, DraftKings: Trending Tickers",2025-06-02
TSLA,ARK’s Cathie Wood Sold Tesla Stock Ahead of Robotaxi Launch,2025-06-02
TSLA,"After 4 Months, Elon Musk Learned What Every American Already Knows, Says Ross Gerber: 'No One In Government Wants To Cut Any Budget'",2025-06-02
TSLA,Sector Update: Consumer Stocks Rise Late Afternoon,2025-06-02
TSLA,Tesla Stock Is Falling. Why June Is Starting With a Loss.,2025-06-02
TSLA,Tesla Under Pressure as Musk Renews His Focus,2025-06-02
TSLA,"Stocks to Watch Monday: Alphabet, Tesla, UnitedHealth, Applied Digital",2025-06-02
TSLA,Elon Musk's xAI Plans $300 Million Share Offering,2025-06-02
TSLA,Elon Musk's $113 Billion AI Power Play Is Just Getting Started,2025-06-02
TSLA,Sector Update: Consumer Stocks Decline in Afternoon Trading,2025-06-02
TSLA,Elon Musk Once Asked Why Epstein-Maxwell Client List Hasn't Leaked — Here's How He Responded to X User Who Suggested He Was a Client,2025-06-02
TSLA,Top Midday Decliners,2025-06-02
TSLA,Elon Musk Has Stepped Away From DOGE. He Still Has Plenty Going On,2025-06-02
TSLA,Pound closes in on three-year high as concerns over US tariffs mount,2025-06-02
TSLA,"Musk's xAI launches $5 billion debt sale, seeks $113 billion valuation, media reports say",2025-06-02
TSLA,"The most EV-friendly country in the world is still loyal to Tesla, as Model Y sales surge in May",2025-06-02
TSLA,Tesla Under Pressure in Europe's EV Race,2025-06-02
MSFT,Nvidia Can’t Afford to Get Walled Off From China — Heard on the Street,2025-06-02
MSFT,"Microsoft, CrowdStrike, other cyber firms collaborate on threat actor taxonomy",2025-06-02
MSFT,Palantir's AIP Platform Sees Soaring Adoption Across Enterprises,2025-06-02
MSFT,'Forest Blizzard' vs 'Fancy Bear' - cyber companies hope to untangle weird hacker nicknames,2025-06-02
MSFT,McKinsey's AI Now Writes the Deck--Is This the Future of Consulting?,2025-06-02
MSFT,"Intel, Microsoft Lead Tech Layoffs Slowdown",2025-06-02
MSFT,"Microsoft CEO Defends 6,000 Job Cuts as 'Strategic, Not Firings'",2025-06-02
MSFT,Should You Hold on to MSFT Stock in 2025 Beyond its 9% YTD Growth?,2025-06-02
MSFT,LinkedIn slashes 281 jobs across California in US,2025-06-02
MSFT,No ‘Gray’ Area in New York Times’ AI Deal with Amazon,2025-06-02
MSFT,"Microsoft to invest $400 million in Switzerland on AI, cloud computing",2025-06-02
MSFT,Microsoft’s Russian subsidiary to file for bankruptcy,2025-06-02
MSFT,4 Monster Stocks to Buy and Hold for the Next Decade,2025-06-02
MSFT,Nvidia CEO Jensen Huang Just Delivered Incredible News for Amazon Investors,2025-06-02
MSFT,"Billionaire David Tepper Bought More Shares of This Artificial Intelligence (AI) Stock That Could Join Apple, Microsoft, and Nvidia in the $3 Trillion Club by 2030",2025-06-02
MSFT,1 No-Brainer Artificial Intelligence (AI) ETF to Buy With $50 During the S&P 500 Bull Market,2025-06-02
NVDA,Nvidia rival Groq makes a bold prediction on what's next for AI,2025-06-02
NVDA,Nvidia stock's 6 eras: Comparing it to the rest of the chip sector,2025-06-02
NVDA,"Dow Jones Futures Fall After Strong Market Close; Meta, These Gold Plays Break Out",2025-06-03
NVDA,"This AI Giant Is Among the Top 5 Holdings of Billionaires David Tepper, Philippe Laffont, and Stephen Mandel Jr. -- and It's Not Nvidia",2025-06-03
NVDA,Why Broadcom Stock Blew Past the Market on Monday,2025-06-02
NVDA,Better Artificial Intelligence Stock: Nvidia vs. AMD,2025-06-02
NVDA,Palantir Stock vs. Taiwan Semiconductor Stock: Wall Street Says Buy One and Sell the Other,2025-06-02
NVDA,Applied Digital Stock Soars on AI Data Center Deal with Nvidia-Backed CoreWeave,2025-06-02
NVDA,Why IonQ Stock Soared 47% in May,2025-06-02
NVDA,Prediction: Nvidia Will Beat the Market. Here's Why,2025-06-02
NVDA,Is Nvidia Stock a Bargain?,2025-06-02
NVDA,"Nvidia Rises Amid Trump-China Trade Flare Up Risk, Huang To Sell $800 Mil. Stock; Is Nvidia A Buy Or Sell Now?",2025-06-02
NVDA,NVIDIA (NasdaqGS:NVDA) Partners With Illumio To Enhance Zero Trust Security For Critical Infrastructure,2025-06-02
NVDA,"Cisco Stock Is a Buy Because It Is Hidden Sovereign AI Play, Says Analyst",2025-06-02
NVDA,The Week in AI,2025-06-02
NVDA,UBS: Nvidia Could Capture $20 Billion from Texas AI Center,2025-06-02
NVDA,"Stock Market Today: Dow Jones Gains, Other Indexes Rise; Cathie Wood Loads Up On This Stock Amid 83% Dive (Live Coverage)",2025-06-02
NVDA,"Is Vertiv Stock's 15.43X P/B Still Worth it? Buy, Sell, or Hold?",2025-06-02
AAPL,Nvidia reclaims crown as world's most valuable company as $1 trillion rally continues,2025-06-03
AAPL,The DOJ’s Apple Ruling Could Spark the Super App Revolution and Redefine Retail,2025-06-03
AAPL,Nvidia Overtakes Microsoft as Largest U.S. Company by Market Cap,2025-06-03
AAPL,Magnificent Seven Earnings Triple S&P Peers,2025-06-03
AAPL,These 2 Tech Titans Generate Substantial Cash: MSFT & AAPL,2025-06-03
AAPL,Apple tells Met to embrace ‘traditional policing’ in clash over phone thefts,2025-06-03
AAPL,OpenAI's $6.4 Billion Hardware Gamble Exposes the Closed AI Trap,2025-06-03
AAPL,A Short Strangle Apple Stock Trade Brings High Premiums — And High Risk,2025-06-03
AAPL,"Jony Ive, Described By Sam Altman As 'The Greatest Designer In The World' Joins OpenAI In $6.5B Deal To Build 'A Totally New Kind Of Thing'",2025-06-03
AAPL,Nvidia’s $1 Trillion Rally Has Traders Primed to Ramp Back Up,2025-06-03
AAPL,Latest News In Cloud AI - Agentuity Launches World’s First Agent-Native Cloud Platform,2025-06-03
AAPL,Apple Challenges EU Order Mandating Ecosystem Access,2025-06-03
AAPL,5 Top Stocks to Buy in June,2025-06-03
AAPL,Warren Buffett Has 48% of His $281 Billion Portfolio Invested in 3 Exceptional Stocks,2025-06-03
AAPL,These 2 Dow Stocks Are Set to Soar in 2025 and Beyond,2025-06-03
AAPL,S&P 500's breakout May was largely a result of Mag 7 gains,2025-06-03
AAPL,Apple Appeals EU's Interoperability Mandate,2025-06-03
AAPL,Apple WWDC Is Coming. What ‘Low Investor Expectations’ Mean for the Stock.,2025-06-03
AAPL,The Magnificent Seven Stocks Staged a Blistering May Rally. What's Next?,2025-06-03
