company,title,published_date
NVDA,Arm shares slump as weak forecasts fuel investor worries,2025-05-08
IBM,Commentary: These Trumpers aren't worried about a Trump recession,2025-05-07
IBM,Kyndryl beats quarterly revenue estimates on AI push,2025-05-07
IBM,Is International Business Machines Corporation (IBM) the Best Dow Stock?,2025-05-07
IBM,International Business Machines Corporation (IBM): Watsonx Teams With Oracle Cloud to Advance Multi-Agent AI Workflows,2025-05-07
IBM,International Business Machines' (NYSE:IBM) Dividend Will Be Increased To $1.68,2025-05-07
IBM,IBM Report: Canadian CEOs Embrace AI,2025-05-07
IBM,IBM CEO sees AI reshaping workforce and enterprise strategy,2025-05-07
IBM,IBM CEO urges the Trump administration to increase — not cut — federal AI R&D funding,2025-05-07
IBM,IBM (IBM) Expands AI Push With Launch of watsonx Orchestrate for Enterprise Agents,2025-05-07
IBM,International Business Machines (NYSE:IBM) Expands AI Innovations With Lumen And Oracle Collaborations,2025-05-07
IBM,"IBM CEO Says AI Has Replaced Hundreds of Workers But Created New Programming, Sales Jobs",2025-05-07
IBM,"IBM Vows AI, Quantum Push with $150B Bet",2025-05-07
MSFT,Microsoft could have major advantage over big tech rivals.,2025-05-08
NVDA,Here’s why Trump killing the ‘AI diffusion rule’ is a win for chipmakers,2025-05-08
AAPL,"Apple is developing specialized chips for smart glasses and AI servers, Bloomberg News reports",2025-05-08
AAPL,Google-Parent Alphabet Shares Decline as More People Use AI for Search,2025-05-08
AAPL,Alphabet Stock Climbs After Google Defends $20B Apple Deal,2025-05-08
AAPL,"Apple Is Developing Specialized Chips for Glasses, New Macs and AI Servers",2025-05-08
MSFT,Q2 2025 Cerence Inc Earnings Call,2025-05-08
NVDA,Nvidia Stock Wobbles On Uncertainty Over Trump AI Chip Policy,2025-05-08
NVDA,"Chipmakers like Nvidia, AMD get a gift from Washington",2025-05-08
NVDA,Nvidia and other chipmakers are getting a big win as Trump kills the 'AI diffusion rule',2025-05-08
NVDA,"These Stocks Are Moving the Most Today: Arm, AppLovin, Alphabet, Coinbase, D-Wave Quantum, Fortinet, Carvana, Cleveland-Cliffs, and More",2025-05-08
AAPL,"Stock market today: Dow, S&P 500, Nasdaq fall as Trump tariff threats roar back, US deficit anxiety deepens",2025-05-23
AAPL,Apple's Tim Cook thought he had a Plan B for Trump's tariffs. It wasn't enough.,2025-05-23
AAPL,Battle for AI dominance: OpenAI's moves target Apple & Google,2025-05-23
AAPL,ChatGPT: Everything you need to know about the AI-powered chatbot,2025-05-23
AAPL,"EU tariffs, Ross and Deckers, Nvidia earnings: 3 Things",2025-05-23
AAPL,"OpenAI looks to ship 100M AI ‘companion’ devices for everyday life, WSJ reports",2025-05-24
AAPL,"Apple Faces 'First Serious Threat In 20 Years' As OpenAI Acquires iPhone Maker's Former Design Chief Jony Ive's Hardware Startup, Says Gene Munster",2025-05-24
AAPL,Tim Cook’s Bad Year Keeps Getting Worse,2025-05-24
AAPL,"Stocks to Watch: Apple, Booz Allen, Constellation Energy, Intuit",2025-05-23
AAPL,Tim Cook Called Texas Governor to Stop Online Child-Safety Legislation,2025-05-23
AAPL,"Trump Threatens Fresh Tariffs on EU, iPhones and Rival Devices",2025-05-23
AAPL,Wall Street Declines After Trump's Fresh Tariff Threats; Apple Falls 3%,2025-05-23
AAPL,"Trump Threatens EU, Smartphones as Tariff Rhetoric Escalates",2025-05-23
AAPL,"Trump Targets Samsung, Apple Phones With 25% Tariff Threat",2025-05-23
AAPL,"US Equity Indexes Fall in Week on Treasury Market Jitters, Trump Warnings to EU, Apple",2025-05-23
AAPL,"Stocks Fall on Tariff Broadside, After Week of Bond Market Agita",2025-05-23
AAPL,Apple Stock Falls As Trump Threatens iPhone Tariff,2025-05-23
AAPL,Apple Is Unlikely to Escape Tariffs This Time. Trump Is Doubling Down.,2025-05-23
AAPL,Dollar Falls to Lowest Since 2023 as Investors Eye Trade Risks,2025-05-23
AAPL,"Equity Markets Close Lower as Trump Proposes New Tariffs on EU, Apple",2025-05-23
IBM,IBM vs. Accenture: Which Stock Stands Out in the Consulting Game?,2025-05-23
IBM,IBM (IBM) Up 12.7% Since Last Earnings Report: Can It Continue?,2025-05-23
IBM,"Analyst Highlights Potential ‘Big Driver’ for IBM (IBM), Calls Pullback ‘Transitory’",2025-05-23
IBM,IONQ Stock Surges on Strategic Quantum Acquisitions,2025-05-23
IBM,IBM Rides the AI Wave to New Highs. Wall Street Is Having Second Thoughts.,2025-05-23
IBM,IBM powers technology upgrade for Sri Lanka’s Pan Asia Bank,2025-05-23
TSLA,Big Tech's spending drove Nvidia's rise,2025-05-23
TSLA,From Tesla to forests: what Nest does with 13m UK savers’ pension cash,2025-05-24
TSLA,Elon Musk's Tesla holds billions in uncommon asset,2025-05-23
TSLA,Elon Musk Wants The US Government To Hang Up The Phone: 'Government Is Wasting About $100 Million Per Year On Unused Phone Lines',2025-05-23
TSLA,Tesla (TSLA)’s Next Big Catalyst? Piper Points to Austin Robo-Taxi Launch,2025-05-23
TSLA,"Tesla Bull Dan Ives Thinks Elon Musk's EV Giant Could Be Entering A 'Golden Era,' Says 2 Trillion Market Cap 'On The Table'",2025-05-23
TSLA,Tesla Stock Drops as Trump Tariff Threats Take Focus Off Magical Thinking,2025-05-23
TSLA,"These Stocks Moved the Most Today: Apple, Tesla, Intuit, Oklo, Deckers, Workday, Ross Stores, Booz Allen, and More",2025-05-23
TSLA,Tesla (TSLA) Gets Street-High $500 Price Target as Wedbush Touts $1T AI Upside,2025-05-23
TSLA,"Update: Wedbush Ups Price Target on Tesla to $500 From $350 Highlighting Key Launch in June, Maintains Outperform Rating",2025-05-23
TSLA,"Magnificent Seven Stocks: Apple Extends Losing Streak; Nvidia, Tesla Slide",2025-05-23
TSLA,Elon Musk to Nvidia Rescue With Massive GPU Orders,2025-05-23
TSLA,Why Wedbush Is Back Among the Street's Top Tesla Stock Bulls,2025-05-23
TSLA,Tesla Slides as Grok Rolls Into Federal Agencies,2025-05-23
TSLA,Tesla Eyes $500 Peak as Autonomy Era Dawns,2025-05-23
TSLA,Tesla stock gets a huge price target hike as Wedbush hails 'golden age of autonomous growth',2025-05-23
TSLA,"Tesla Set to Start New Growth Era in AI, Autonomous Tech, Wedbush Says",2025-05-23
TSLA,"Was Jim Cramer Right About Tesla, Inc. (TSLA)?",2025-05-23
TSLA,BYD overtakes Tesla in Europe for first time in BEV registrations,2025-05-23
TSLA,"Tesla (TSLA) Will No Longer Be Seen as “Just” an Automaker, Investor Says",2025-05-23
MSFT,"Microsoft says its Aurora AI can accurately predict air quality, typhoons, and more",2025-05-23
MSFT,Trump's FTC walks away from Microsoft-Activision merger fight started by Biden,2025-05-23
MSFT,Trump tariffs: Which companies will raise prices vs. eat the cost,2025-05-23
MSFT,"FTC drops case over Microsoft’s $69B deal for Activision, Reuters reports",2025-05-24
MSFT,Why Evercore Is Even More Bullish on Microsoft (MSFT) After Its 360 Event,2025-05-23
MSFT,Microsoft Stock Earns Bullish Notes On AI Agents,2025-05-23
MSFT,Top Funds Have Designs On This Nvidia-Powered Long-Term Leader,2025-05-23
MSFT,"Microsoft just took the next big step in the AI race, Deutsche Bank says",2025-05-23
MSFT,FTC abandons Biden-era effort to block Microsoft's acquisition of Activision Blizzard,2025-05-23
MSFT,U.S. Treasuries Might Be Wildly Undervalued. Here’s an Example.,2025-05-23
MSFT,Carbon Direct and Microsoft issue criteria for EACs in concrete and steel sectors,2025-05-23
MSFT,CoreWeave Bulls Face Off Against Short Sellers as Shares Spike,2025-05-23
MSFT,Trump plots ‘Manhattan Project 2’ in nuclear power push,2025-05-23
MSFT,"Top Analyst Lifts Microsoft Price Target to $515, Says 'All In on AI'",2025-05-23
MSFT,Cloud AI Today - NexAI Revolutionizes Campaign Strategy With Generative AI Integration,2025-05-23
MSFT,How CoreWeave Plans To Rule The AI Cloud With Nvidia In Its Corner,2025-05-23
MSFT,2 Super AI Stocks Down 62% and 88% You'll Regret Not Buying on the Dip in 2025,2025-05-23
MSFT,Zacks Investment Ideas feature highlights: Salesforce and Microsoft,2025-05-23
NVDA,"Nvidia earnings, Fed Chair Powell, April PCE: What to Watch",2025-05-23
NVDA,"Nvidia to report Q1 earnings as Middle East deals, export control reprieve boost stock",2025-05-23
NVDA,What Analysts Think of Nvidia Stock Ahead of Earnings,2025-05-24
NVDA,These 3 Artificial Intelligence (AI) Stocks Look Cheap Right Now,2025-05-24
NVDA,Billionaire Philippe Laffont Just Sold Shares of Nvidia and 2 Other AI Powerhouses and Bought Shares of This Nvidia-Backed Company,2025-05-24
NVDA,"Bitcoin New All-Time High: If History Is Any Guide, This Happens Next",2025-05-24
NVDA,Billionaire CEO Jamie Dimon Says America Is Still the Best Place to Invest: 2 U.S. Stocks to Buy Now,2025-05-24
NVDA,Taking Stock of the Earnings Picture,2025-05-23
NVDA,Will Nvidia Stock Keep Rebounding as Q1 Earnings Approach?,2025-05-23
NVDA,Analyst Reiterates Buy on Nvidia (NVDA): ‘Best Positioned in AI’,2025-05-23
NVDA,"Oracle Corporation (ORCL) Plans $40 Billion Nvidia Chip Purchase for OpenAI Data Center Project, FT Says",2025-05-23
NVDA,Oracle to spend $40 billion on Nvidia chips for OpenAI data center - FT,2025-05-23
NVDA,"Oracle to buy $40 billion of Nvidia chips for OpenAI's US data center, FT reports",2025-05-23
NVDA,Nvidia (NVDA) Hits Reset as Cloud Spending Slows,2025-05-23
NVDA,Analysts double price target of new AI stock backed by Nvidia,2025-05-23
NVDA,Why Quantum Computing Stock Skyrocketed This Week,2025-05-23
NVDA,Polen Capital Global Growth has an Uncertain Outlook on NVIDIA Corporation (NVDA),2025-05-23
NVDA,The Weekend: A blow to the US economy takes the shine off a UK-EU trade deal,2025-05-24
AAPL,Apple's Tim Cook thought he had a Plan B for Trump's tariffs. It wasn't enough.,2025-05-24
AAPL,Investing in Dividend Stocks: The Stability of Warren Buffett's Picks,2025-05-24
AAPL,"Ex-Apple Engineers Behind $200M Xnor Deal Launch ElastixAI, Secure $16M To Revolutionize AI Inference Across Devices",2025-05-24
AAPL,Mark Zuckerberg Once Vented Why Apple AirPods Have No Competition: 'One Of The Protocols That They Used...',2025-05-24
AAPL,Dan Ives Fires Back: Trump’s Apple Plan Needs ‘Herculean Logistics’,2025-05-24
AAPL,Trump threatens Apple Inc. (AAPL) with New Tariffs if iPhones Not Made in U.S.,2025-05-24
AAPL,"Trump Trade: Trump considers 50% tariff on EU, 25% on iPhones",2025-05-24
AAPL,Morning Movers: Apple slips following President Trump tariff threat,2025-05-24
AAPL,Trump’s new tariff threats show trade uncertainty here to stay,2025-05-24
AAPL,Charting the Global Economy: Long-Term Bond Yields Soar Around the World,2025-05-24
AAPL,AP Top Financial News at 8:07 a.m. EDT,2025-05-24
AAPL,"Stocks to Watch: Apple, Booz Allen, Constellation Energy, Intuit",2025-05-24
AAPL,Tim Cook Called Texas Governor to Stop Online Child-Safety Legislation,2025-05-24
AAPL,"Trump Threatens Fresh Tariffs on EU, iPhones and Rival Devices",2025-05-24
AAPL,Wall Street Declines After Trump's Fresh Tariff Threats; Apple Falls 3%,2025-05-24
AAPL,"Trump Threatens EU, Smartphones as Tariff Rhetoric Escalates",2025-05-24
AAPL,"Trump Targets Samsung, Apple Phones With 25% Tariff Threat",2025-05-24
IBM,IBM vs. Accenture: Which Stock Stands Out in the Consulting Game?,2025-05-24
IBM,IBM (IBM) Up 12.7% Since Last Earnings Report: Can It Continue?,2025-05-24
IBM,"Analyst Highlights Potential ‘Big Driver’ for IBM (IBM), Calls Pullback ‘Transitory’",2025-05-24
TSLA,Big Tech's spending drove Nvidia's rise,2025-05-24
TSLA,Tesla vs. Waymo: The battle of the robotaxis,2025-05-24
TSLA,"Elon Musk Recalls 'Intense' 3 Months At DOGE: Trump's Late-Night Ice Cream Invites, Lincoln Bedroom Sleepovers And Diablo",2025-05-24
TSLA,Musk says he’s back to 24/7 work mode after major X outage,2025-05-24
TSLA,Is Now the Time to Buy Beaten-Down AI Stocks?,2025-05-24
TSLA,"Lehigh County, Pennsylvania Pension Fund's Board Votes To No Longer Purchase Tesla Stock",2025-05-24
TSLA,Tesla Vs. BYD: TSLA Sets Up New Buy Point While Rival Keeps Running,2025-05-24
TSLA,Angry Elon Is Back. That’s Good for Tesla.,2025-05-24
TSLA,Elon Musk's Tesla holds billions in uncommon asset,2025-05-24
TSLA,Elon Musk Wants The US Government To Hang Up The Phone: 'Government Is Wasting About $100 Million Per Year On Unused Phone Lines',2025-05-24
TSLA,Tesla (TSLA)’s Next Big Catalyst? Piper Points to Austin Robo-Taxi Launch,2025-05-24
TSLA,"Tesla Bull Dan Ives Thinks Elon Musk's EV Giant Could Be Entering A 'Golden Era,' Says 2 Trillion Market Cap 'On The Table'",2025-05-24
TSLA,Tesla Stock Drops as Trump Tariff Threats Take Focus Off Magical Thinking,2025-05-24
TSLA,"These Stocks Moved the Most Today: Apple, Tesla, Intuit, Oklo, Deckers, Workday, Ross Stores, Booz Allen, and More",2025-05-24
TSLA,Tesla (TSLA) Gets Street-High $500 Price Target as Wedbush Touts $1T AI Upside,2025-05-24
TSLA,"Update: Wedbush Ups Price Target on Tesla to $500 From $350 Highlighting Key Launch in June, Maintains Outperform Rating",2025-05-24
TSLA,"Magnificent Seven Stocks: Apple Extends Losing Streak; Nvidia, Tesla Slide",2025-05-24
TSLA,Elon Musk to Nvidia Rescue With Massive GPU Orders,2025-05-24
MSFT,FTC Ends Legal Challenge to Microsoft Corporation (MSFT)’s Activision Acquisition,2025-05-24
MSFT,A Once-in-a-Decade Investment Opportunity: 1 Artificial Intelligence (AI) Chip Stock to Buy Hand Over Fist Right This Instant (Hint: It's Not Nvidia),2025-05-24
MSFT,"Sam Altman's $150M AI Chip Bet Crashes: Rain AI Faces Sale As OpenAI, Nvidia, And Microsoft Circle The Wreckage",2025-05-24
MSFT,Why Evercore Is Even More Bullish on Microsoft (MSFT) After Its 360 Event,2025-05-24
MSFT,Microsoft Stock Earns Bullish Notes On AI Agents,2025-05-24
MSFT,Top Funds Have Designs On This Nvidia-Powered Long-Term Leader,2025-05-24
MSFT,FTC drops final challenge to Microsoft’s $69B Activision Blizzard deal,2025-05-24
MSFT,"Microsoft just took the next big step in the AI race, Deutsche Bank says",2025-05-24
MSFT,"Microsoft says its Aurora AI can accurately predict air quality, typhoons, and more",2025-05-24
MSFT,FTC abandons Biden-era effort to block Microsoft's acquisition of Activision Blizzard,2025-05-24
MSFT,U.S. Treasuries Might Be Wildly Undervalued. Here’s an Example.,2025-05-24
MSFT,Carbon Direct and Microsoft issue criteria for EACs in concrete and steel sectors,2025-05-24
MSFT,ChatGPT: Everything you need to know about the AI-powered chatbot,2025-05-24
MSFT,CoreWeave Bulls Face Off Against Short Sellers as Shares Spike,2025-05-24
MSFT,Trump plots ‘Manhattan Project 2’ in nuclear power push,2025-05-24
MSFT,Trump's FTC walks away from Microsoft-Activision merger fight started by Biden,2025-05-24
NVDA,Nvidia earnings: Options plays ahead of the results,2025-05-24
NVDA,Nvidia plans cheaper AI chip for China to navigate U.S. export curbs- Reuters,2025-05-24
NVDA,"Billionaire fund manager, skeptical of AI, backs shocking stock",2025-05-24
NVDA,Is Nvidia Stock a Buy Before May 28?,2025-05-24
NVDA,"Nvidia to launch cheaper Blackwell AI chip for China after US export curbs, sources say",2025-05-24
NVDA,"Exclusive-Nvidia to launch cheaper Blackwell AI chip for China after US export curbs, sources say",2025-05-24
NVDA,Nvidia CEO calls Trump re-industrialization policies 'visionary',2025-05-24
NVDA,Nvidia CEO calls Trump re-industrialisation policies 'visionary',2025-05-24
NVDA,Is Intel Corp Stock a Buy?,2025-05-24
NVDA,"Nvidia earnings, Fed Chair Powell, April PCE: What to Watch",2025-05-24
AAPL,Warren Buffett-led Berkshire Hathaway Has 21% of Its $276 Billion Portfolio in 1 Stock That's Up 644% in 9 Years,2025-05-25
AAPL,"See a big stock rally ahead? Be patient, money manager says",2025-05-25
AAPL,26.4% of Warren Buffett's $258 Billion Portfolio Is Invested in 2 Leading Artificial Intelligence Stocks,2025-05-25
AAPL,Buying Apple Stock Isn't Worth the Risk,2025-05-25
AAPL,Apple Boosts iPhone Trade-In Discounts in China to Reignite Lagging Sales,2025-05-25
AAPL,Apple (AAPL) Faces a New Kind of Rival – And Wall Street Is Paying Attention,2025-05-25
AAPL,"Despite Trump's Warning To Tim Cook, Apple Moves Ahead With $1.5 Billion India Expansion Via Foxconn To Boost iPhone Production: Report",2025-05-25
AAPL,Investing in Dividend Stocks: The Stability of Warren Buffett's Picks,2025-05-25
AAPL,"Ex-Apple Engineers Behind $200M Xnor Deal Launch ElastixAI, Secure $16M To Revolutionize AI Inference Across Devices",2025-05-25
AAPL,"Ships are canceling crossings to U.S., and Trump’s new 50% E.U. tariff threat isn’t likely to help",2025-05-25
AAPL,Mark Zuckerberg Once Vented Why Apple AirPods Have No Competition: 'One Of The Protocols That They Used...',2025-05-25
AAPL,Dan Ives Fires Back: Trump’s Apple Plan Needs ‘Herculean Logistics’,2025-05-25
AAPL,Trump threatens Apple Inc. (AAPL) with New Tariffs if iPhones Not Made in U.S.,2025-05-25
AAPL,"Trump Trade: Trump considers 50% tariff on EU, 25% on iPhones",2025-05-25
AAPL,Morning Movers: Apple slips following President Trump tariff threat,2025-05-25
AAPL,Trump’s New Tariff Threats Show Trade Uncertainty Here to Stay,2025-05-25
AAPL,"OpenAI looks to ship 100M AI ‘companion’ devices for everyday life, WSJ reports",2025-05-25
AAPL,Charting the Global Economy: Long-Term Bond Yields Soar Around the World,2025-05-25
AAPL,AP Top Financial News at 8:07 a.m. EDT,2025-05-25
AAPL,"Apple Faces 'First Serious Threat In 20 Years' As OpenAI Acquires iPhone Maker's Former Design Chief Jony Ive's Hardware Startup, Says Gene Munster",2025-05-25
TSLA,Polling Indicates Tesla's Popularity has Plunged: Should Investors Buy Rivian Stock Now?,2025-05-25
TSLA,Why June Will Be a Make-or-Break Month for Tesla,2025-05-25
TSLA,"Elon Musk back to working ’24/7′ at Tesla, Inc. (TSLA), X and xAI",2025-05-25
TSLA,"Tesla Vs. BYD: Tesla Has New Buy Point; BYD Runs To High, Launches Price War",2025-05-25
TSLA,Tesla Has Another Problem In China. This Time It’s a Smartphone Maker.,2025-05-25
TSLA,Better EV Stock: BYD vs. Tesla,2025-05-25
TSLA,Where Will Lucid Stock Be in 3 Years?,2025-05-25
TSLA,"Wedbush Lifts Tesla (TSLA) Price Target to $500, Cites AI and Autonomous Future",2025-05-25
TSLA,China’s BYD Overtakes Tesla in European EV Sales,2025-05-25
TSLA,"Tesla Robotaxi Launch Could Boost Stock, Says Truist Analyst William Stein",2025-05-25
TSLA,"Tesla Investors Just Got Great News From CEO Elon Musk: The Stock Could Soar 1,300%.",2025-05-25
TSLA,Elon Musk pledges return to '24/7' work at his firms after widespread X outage,2025-05-25
TSLA,Analyst sets eye-popping Tesla stock price target,2025-05-25
TSLA,"Elon Musk Recalls 'Intense' 3 Months At DOGE: Trump's Late-Night Ice Cream Invites, Lincoln Bedroom Sleepovers And Diablo",2025-05-25
TSLA,Musk says he’s back to 24/7 work mode after major X outage,2025-05-25
TSLA,Is Now the Time to Buy Beaten-Down AI Stocks?,2025-05-25
TSLA,"Lehigh County, Pennsylvania Pension Fund's Board Votes To No Longer Purchase Tesla Stock",2025-05-25
TSLA,Tesla vs. Waymo: The battle of the robotaxis,2025-05-25
TSLA,Angry Elon Is Back. That’s Good for Tesla.,2025-05-25
MSFT,"Nvidia has lost its shock power to investors, for now",2025-05-25
MSFT,Could Nvidia Stock Help You Retire a Millionaire?,2025-05-25
MSFT,"Warren Buffett Says Buy This S&P 500 Index Fund -- It Could Soar 156% by 2030, According to a Top Wall Street Analyst",2025-05-25
MSFT,Tech Stocks Had a Crazy Few Days. Another Big Week Is Ahead.,2025-05-25
MSFT,Jefferies: Microsoft (MSFT)’s Copilot Upgrades Are Its Biggest Since Teams,2025-05-25
MSFT,FTC Ends Legal Challenge to Microsoft Corporation (MSFT)’s Activision Acquisition,2025-05-25
MSFT,A Once-in-a-Decade Investment Opportunity: 1 Artificial Intelligence (AI) Chip Stock to Buy Hand Over Fist Right This Instant (Hint: It's Not Nvidia),2025-05-25
MSFT,"Sam Altman's $150M AI Chip Bet Crashes: Rain AI Faces Sale As OpenAI, Nvidia, And Microsoft Circle The Wreckage",2025-05-25
MSFT,"FTC drops case over Microsoft’s $69B deal for Activision, Reuters reports",2025-05-25
MSFT,Big Tech's spending drove Nvidia's rise,2025-05-25
NVDA,"Nvidia earnings, Trump tariff updates, and the Fed's preferred inflation gauge: What to know this week",2025-05-25
NVDA,"NVIDIA Corporation (NVDA) to Launch Cheaper Blackwell AI Chip for China, Says Report",2025-05-25
NVDA,Abu Dhabi–Backed G42 And iGenius Team Up To Build Europe's Most Powerful AI Supercomputer Using Nvidia Chips In Italy,2025-05-25
NVDA,"Trump’s New Tariffs, Nvidia, Salesforce, Costco, and More to Watch This Week",2025-05-25
NVDA,"$600B AI Opportunity: Nvidia's 18,000-Chip Deal With Saudi Arabia's Humain Puts Middle East 'Front Of The Line,' Says Wedbush's Dan Ives",2025-05-25
NVDA,Intel: Now Or Never,2025-05-25
NVDA,Intel’s Xeon 6 CPU Selected for Nvidia’s DGX B300 AI System,2025-05-25
NVDA,"BofA Maintains Neutral Rating on Amphenol (APH), Lifts PT",2025-05-25
NVDA,Nvidia's Gaming Business Could Be in Trouble,2025-05-25
NVDA,"Nvidia, Costco, and Fed minutes: What to watch in the stock market this week",2025-05-25
NVDA,What To Expect in the Markets This Week,2025-05-25
NVDA,Should You Buy Nvidia Stock Before May 28? Wall Street Has a Crystal-Clear Answer for Investors.,2025-05-25
NVDA,Will Nvidia (NVDA) Break Records Again? BofA Thinks So,2025-05-25
NVDA,"Amphenol (APH) May Ride Nvidia’s AI Wave, Says BofA Analyst",2025-05-25
NVDA,Nvidia plans cheaper AI chip for China to navigate U.S. export curbs- Reuters,2025-05-25
AAPL,"Stock market today: Dow, S&P 500, Nasdaq futures leap as EU tariff delay bolsters market optimism",2025-05-27
AAPL,6 charts that capture Nvidia's AI-fueled rise,2025-05-26
AAPL,Stocks Rise on Trump’s Tariff Delay; Dollar Wavers: Markets Wrap,2025-05-26
AAPL,Analyst has blunt words on Trump's iPhone tariff plans,2025-05-26
AAPL,Apple Stock Is On An 8-Day Losing Streak As Trump Trade Fracas Intensifies—Watch These Levels,2025-05-26
AAPL,Gold Slips as Haven Demand Eases After Trump Delays EU Tariffs,2025-05-26
AAPL,US futures jump while Asian shares slip after Trump delays tariffs on the EU,2025-05-26
AAPL,European shares gain after Trump pushes back planned 50% tariffs on EU,2025-05-26
AAPL,Kashkari Says ‘Not Sure’ on Interest Rate Moves by September,2025-05-26
AAPL,WiseTech Buys E2Open for $2.1 Billion in Its Biggest Deal,2025-05-26
AAPL,Warren Buffett-led Berkshire Hathaway Has 21% of Its $276 Billion Portfolio in 1 Stock That's Up 644% in 9 Years,2025-05-26
AAPL,"See a big stock rally ahead? Be patient, money manager says",2025-05-26
AAPL,26.4% of Warren Buffett's $258 Billion Portfolio Is Invested in 2 Leading Artificial Intelligence Stocks,2025-05-26
AAPL,Buying Apple Stock Isn't Worth the Risk,2025-05-26
AAPL,Apple Boosts iPhone Trade-In Discounts in China to Reignite Lagging Sales,2025-05-26
AAPL,Apple (AAPL) Faces a New Kind of Rival – And Wall Street Is Paying Attention,2025-05-26
AAPL,"Despite Trump's Warning To Tim Cook, Apple Moves Ahead With $1.5 Billion India Expansion Via Foxconn To Boost iPhone Production: Report",2025-05-26
TSLA,Why Nvidia’s rise could signal bad news for climate goals,2025-05-26
TSLA,Elektro Uncovers Potential for Major Lithium Deposit in Sierra Leone,2025-05-26
TSLA,NIO vs. TSLA: Which EV Stock Has More Charge for the Future?,2025-05-26
TSLA,"Tesla Vs. BYD: TSLA Has New Buy Point; BYD Runs To High, Launches Price War",2025-05-26
TSLA,BYD's EV Sales in Europe Surpass Tesla for the First Time,2025-05-26
TSLA,Mark Cuban Calls Elon Musk 'Thin Skinned' But Still Owns a Tesla — Says He'd Rather Drive His Electric Kia Because 'It Doesn't Try To Be Too Fancy',2025-05-26
TSLA,BYD launches attempt to crush Tesla in China,2025-05-26
TSLA,"Elon Musk, Jeff Bezos: rivals for space, trucks, satellite dominance",2025-05-26
TSLA,Chinese EV Stocks Tumble After BYD Slashes Prices as Much as 34%,2025-05-26
TSLA,Polling Indicates Tesla's Popularity has Plunged: Should Investors Buy Rivian Stock Now?,2025-05-26
TSLA,Why June Will Be a Make-or-Break Month for Tesla,2025-05-26
TSLA,"Elon Musk back to working ’24/7′ at Tesla, Inc. (TSLA), X and xAI",2025-05-26
TSLA,Tesla Has Another Problem In China. This Time It’s a Smartphone Maker.,2025-05-26
TSLA,Better EV Stock: BYD vs. Tesla,2025-05-26
TSLA,Where Will Lucid Stock Be in 3 Years?,2025-05-26
TSLA,"Wedbush Lifts Tesla (TSLA) Price Target to $500, Cites AI and Autonomous Future",2025-05-26
TSLA,China’s BYD Overtakes Tesla in European EV Sales,2025-05-26
TSLA,"Tesla Robotaxi Launch Could Boost Stock, Says Truist Analyst William Stein",2025-05-26
TSLA,"Tesla Investors Just Got Great News From CEO Elon Musk: The Stock Could Soar 1,300%.",2025-05-26
MSFT,How Nvidia 'played a central role' in the $306 billion AI startup boom,2025-05-26
MSFT,US Prosecutors Sought Builder.ai Data After Sales Overstated,2025-05-26
MSFT,"Nvidia has lost its shock power to investors, for now",2025-05-26
MSFT,Could Nvidia Stock Help You Retire a Millionaire?,2025-05-26
MSFT,"Warren Buffett Says Buy This S&P 500 Index Fund -- It Could Soar 156% by 2030, According to a Top Wall Street Analyst",2025-05-26
MSFT,Tech Stocks Had a Crazy Few Days. Another Big Week Is Ahead.,2025-05-26
MSFT,Jefferies: Microsoft (MSFT)’s Copilot Upgrades Are Its Biggest Since Teams,2025-05-26
NVDA,Nvidia is an AI name you want to own and 'take advantage of',2025-05-26
NVDA,"Nvidia, Salesforce, Kohl's: Earnings to Watch This Week",2025-05-26
NVDA,US stock futures jump as Trump delays 50% tariffs against the EU,2025-05-27
NVDA,Will Nvidia Soar After May 28? History Offers a Decidedly Clear Answer.,2025-05-27
NVDA,Analysts issue rare warning on Nvidia stock before key earnings,2025-05-26
NVDA,Amazon Just Sent a Massive Warning to Nvidia Investors,2025-05-26
NVDA,Tariff Negotiations Could Derail Nvidia's China Business. Here's Why I'm Not Worried About It.,2025-05-26
NVDA,Nvidia (NVDA) to Help Build Sweden’s First AI Infrastructure,2025-05-26
NVDA,CoreWeave’s (CRWV) Ascent Implies That with Great Data Comes Great Responsibility,2025-05-26
NVDA,NVIDIA's Q1 Earnings to Benefit From AI and Datacenter Growth,2025-05-26
