company,title,published_date
TSLA,Where Will Rivian Stock Be in 1 Year?,2025-04-28
TSLA,Jim Cramer Says ‘When Tesla Inc. (TSLA) Goes Down It Tends To Hurt Everything Related’,2025-04-28
TSLA,Tesla Has Crashed 35% in 2025: Is It Time to Buy the Stock?,2025-04-28
TSLA,"Since DOGE Was Created, This Is How Much Dogecoin Has Crashed",2025-04-28
TSLA,Tesla Stock Investors: Elon Musk Expects 99% Market Share in This Trillion-Dollar Industry,2025-04-28
MSFT,Apple has tariff problems its Big Tech peers do not,2025-05-03
MSFT,"Microsoft (MSFT), Meta Platforms (META) Reported “Home Run” Results: Dan Ives’ Recent Comments",2025-05-03
MSFT,"Google, Microsoft, Meta, And McLaren Back Mombak's $30M Amazon Reforestation Push, Targeting $600M In Carbon Credit Deals By 2025",2025-05-03
MSFT,Warren Buffett's Favorite 'Single Best Measure' For Equities Flashes Buying Signal As US Stocks Rebound,2025-05-03
MSFT,Young Americans Sours on Trump’s China Tariffs Despite Election-Year Bump,2025-05-03
MSFT,"Mark Zuckerberg's Meta dreams, Microsoft's earnings smash, and Reddit's surprise: Tech news roundup",2025-05-03
MSFT,Investing.com’s stocks of the week,2025-05-03
MSFT,Q1 2025 Brookfield Renewable Partners LP Earnings Call,2025-05-03
MSFT,Microsoft Beats Apple to Become Largest U.S. Company by Market Cap,2025-05-03
MSFT,The AI Trade Is Showing New Signs of Life. What We Learned From Big Tech Earnings.,2025-05-03
MSFT,Is Microsoft (MSFT) the Best NASDAQ Stock to Buy According to Billionaires?,2025-05-03
MSFT,TSMC Stock Rallies After Morgan Stanley Names It Top Pick on AI Demand,2025-05-03
MSFT,Should You Hold NVIDIA Stock as Meta & Microsoft Double Down on AI?,2025-05-03
MSFT,Tarrifs in focus as Apple follows up ‘best quarter ever’,2025-05-03
MSFT,Microsoft (NasdaqGS:MSFT) Enhances Secure Authentication With Entra ID And YubiKeys,2025-05-03
MSFT,What Apple Earnings Reveal About Trump’s Trade War,2025-05-03
MSFT,"Magnificent Seven Stocks: Meta, Nvidia, Tesla Rally; Apple Dives On Earnings",2025-05-03
MSFT,Why CoreWeave Stock Rose 11% in April,2025-05-03
MSFT,"Stock Market Powers Higher On Microsoft, Meta, Trump Tariff Hopes: Weekly Review",2025-05-03
MSFT,"Microsoft raises prices of Xbox consoles, accessories, games worldwide",2025-05-03
MSFT,"4 Stocks That Turned $1,000 Into $1 Million",2025-05-03
MSFT,Microsoft price target raised to $520 from $511 at Bernstein,2025-05-03
MSFT,Apple and Amazon results show 'Magnificent 7' shaken by Trump's tariff turmoil but still resilient,2025-05-03
MSFT,Taiwan Semiconductor Gains On Strong Earnings From Meta And Microsoft Boosting AI Demand,2025-05-03
MSFT,Analysts reset Microsoft stock target amid post-earnings rally,2025-05-03
MSFT,Microsoft hikes Xbox prices worldwide as gaming industry faces tariff uncertainty,2025-05-03
MSFT,"Apple Hit With Downgrades as Tariff, Growth Worries Increase",2025-05-03
MSFT,Amazon Braces for Tougher Business Climate as US Tariffs Hit,2025-05-03
MSFT,"Zacks Investment Ideas feature highlights: Boston Scientific, Meta Platforms and Microsoft",2025-05-03
MSFT,Microsoft (MSFT) Skyrockets $200 Billion on Blowout Azure and AI Growth,2025-05-03
MSFT,Dow Jones Futures Rise As China Says It's 'Evaluating' U.S. Trade Talks. Apple Falls On Earnings.,2025-05-03
MSFT,"Report: Microsoft Weighs Hosting Elon Musk's Grok, Risking Fallout With OpenAI",2025-05-03
MSFT,Tech investing playbook: Evolution of Big Tech dominance,2025-05-03
MSFT,What Big Tech Has Going for It in the Trade War,2025-05-03
MSFT,Goldman Sachs Raises Price Target on MSFT,2025-05-03
MSFT,"Why CoreWeave, Inc. (CRWV) Soared On Thursday",2025-05-03
MSFT,Why Microsoft Corporation (MSFT) Soared On Thursday,2025-05-03
MSFT,Why the AI Trade May Not Save the Market From Trump’s Tariffs for Long,2025-05-03
MSFT,Buy Meta Platforms or Microsoft Stock After Beating Earnings Expectations?,2025-05-03
MSFT,"Microsoft swaps law firms in shareholder case, hiring Trump adversary",2025-05-03
MSFT,"Equities Advance as Microsoft, Meta Results Help Ease Economic Worries",2025-05-03
MSFT,Why Microsoft Stock Had One of Its Best Post-Earnings Days in a Decade,2025-05-03
MSFT,These 3 Stocks Soared Following Strong Quarterly Results,2025-05-03
MSFT,Microsoft Hikes Xbox And Game Prices Globally,2025-05-03
MSFT,"Stock Market Today: Nasdaq Surges As Meta, Microsoft Recover Lost Ground; These Two Leading Growth Stocks Jam (Live Coverage)",2025-05-03
MSFT,Amazon's Profit Forecast Misses Estimates,2025-05-03
MSFT,S&P 500 Gains and Losses Today: Index Rises After Strong Start to Big Tech Earnings,2025-05-03
MSFT,The Nasdaq soars as Big Tech earnings have stocks shrugging off recession alarms,2025-05-03
MSFT,"These Stocks Moved the Most Today: Microsoft, Eli Lilly, Kohl’s, Apple, Tesla, Meta, Qualcomm, CVS, and More",2025-05-03
MSFT,Why Meta and Microsoft are drawing investors back to Big Tech,2025-05-03
MSFT,"What AI Slowdown? Nvidia Rallies As Meta, Microsoft Boost Data Center Spending.",2025-05-03
MSFT,"US Equities Markets End Higher Thursday as Investors Await Apple, Amazon Results",2025-05-03
MSFT,"Amazon beats on Q1 earnings, but light Q2 guidance weighs on stock",2025-05-03
MSFT,Why Applied Digital Stock Is Skyrocketing Today,2025-05-03
MSFT,"Today's Market: S&P 500 Climbs as Meta, Microsoft Ease Fears Over AI Slowdown",2025-05-03
MSFT,"Stock market today: Nasdaq surges as AI trade reignites amid Big Tech earnings, Dow, S&P 500 rise for 8th day",2025-05-03
MSFT,Why Nuclear Stocks Soared Today,2025-05-03
MSFT,Microsoft Just Made $70 Billion Look Easy -- And It's Only Getting Started,2025-05-03
MSFT,"Microsoft Raises Prices on Xbox, Games",2025-05-03
MSFT,Why Is Microsoft (MSFT) Stock Soaring Today,2025-05-03
MSFT,Supermicro Stock Is Soaring Today. Should You Buy The Hot AI Stock Before May 6?,2025-05-03
MSFT,"Microsoft, Meta Gains Help Lift Equities Ahead of Apple Earnings",2025-05-03
MSFT,"Shake Shack Q1 miss, Utz stock slips, Sirius XM guidance",2025-05-03
MSFT,Microsoft Soars on Cloud Growth,2025-05-03
MSFT,Microsoft Stock Gets Biggest Earnings Boost Since 2015. ‘Our Downgrade Looks Pretty Foolish Right Now.’,2025-05-03
MSFT,"Microsoft raises Xbox console prices, games to start at $80 amid tariff uncertainty",2025-05-03
MSFT,Why Taiwan Semiconductor Manufacturing Stock Is Jumping Today,2025-05-03
MSFT,Vertiv and Other Growth Stocks Are the Place to Be After Microsoft and Meta Earnings,2025-05-03
MSFT,Is the AI Trade Back on After Meta and Microsoft Earnings?,2025-05-03
MSFT,Why CoreWeave Stock Is Skyrocketing Today,2025-05-03
MSFT,"Strong Tech Earnings, China Trade Optimism Boost US Equity Indexes",2025-05-03
MSFT,Microsoft Briefly Nabs Apple's Crown,2025-05-03
MSFT,Why Microsoft Stock Popped This Week,2025-05-03
MSFT,"Apple, Amazon shares slip after hours; tech shares jump earlier",2025-05-03
MSFT,Nvidia Is Jumping Today -- Is the Artificial Intelligence (AI) Stock a Buy?,2025-05-03
MSFT,Microsoft (NasdaqGS:MSFT) Reports US$70 Billion Revenue With US$26 Billion Net Income,2025-05-03
MSFT,CoreWeave shares jump as hyperscalers boosts AI spend,2025-05-03
MSFT,"Microsoft preparing to host Musk's Grok AI model, The Verge reports",2025-05-03
MSFT,Microsoft Stock Rockets Higher as Analysts Raise Price Targets on AI-Fueled Growth,2025-05-02
MSFT,Why Microsoft Stock Is Skyrocketing Today,2025-05-02
MSFT,"US Equity Indexes Rise on Strong Tech Earnings, China Trade Optimism",2025-05-02
MSFT,Why Nvidia Stock Bounded Higher Thursday,2025-05-02
MSFT,Why Nebius Group Stock Soared Today,2025-05-02
MSFT,Nvidia Stock Rises. The AI Trade Is So Back.,2025-05-02
MSFT,"Microsoft Delivers Strong Fiscal Q3 as Cloud, AI Deliver, Wedbush Says",2025-05-02
MSFT,"Top Stock Movers Now: Microsoft, Meta Platforms, Roblox, and More",2025-05-02
MSFT,Apple Stock Seesaws As Earnings Loom,2025-05-02
MSFT,"Top Midday Stories: Microsoft, Meta Earnings Top Estimates; Eli Lilly Cuts Guidance Despite Strong Q1 Earnings",2025-05-02
MSFT,"Artificial Intelligence IPO CoreWeave Pops On Microsoft, Meta Earnings",2025-05-02
MSFT,"Microsoft capex to grow at slower rate, CFO says",2025-05-02
MSFT,ChatGPT: Everything you need to know about the AI-powered chatbot,2025-05-02
MSFT,US weighs easing Nvidia chip curbs on UAE as Trump plans visit,2025-05-02
MSFT,"Is Microsoft a ""Buy"" After Strong Q1 Earnings?",2025-05-02
MSFT,"Bitcoin, XRP, and Other Cryptos Rally. Is $100K Next?",2025-05-02
MSFT,Amazon Earnings On Deck. Did Microsoft's Strong Results Raise The Bar For Cloud Growth?,2025-05-02
MSFT,"AI ETFs Set to Gain on Robust Meta, Microsoft Earnings",2025-05-02
MSFT,"Jobless claims rise, Meta and Microsoft reviving AI trade",2025-05-02
MSFT,Microsoft Q3 Earnings & Revenues Beat on Surging Cloud Business,2025-05-02
MSFT,Microsoft stock surges 9% as Azure earnings smash expectations and the AI boom rolls on,2025-05-02
MSFT,Microsoft to raise Xbox console prices in the UK,2025-05-02
MSFT,Microsoft: Oppenheimer analysts see continued durable growth ahead,2025-05-02
MSFT,"Microsoft Hikes Prices for Xbox Consoles, Games",2025-05-02
MSFT,"U.S. Stocks Higher, Led by Tech",2025-05-02
MSFT,Microsoft Corporation (MSFT): Jim Cramer Says “Too Many Data Centers?” — Is Microsoft Losing the AI Edge?,2025-05-02
MSFT,"Expect Microsoft's cloud, AI growth to offset billions in CapEx",2025-05-02
MSFT,Microsoft races to keep up with surging cloud demand,2025-05-02
MSFT,Cloud & AI Power Microsoft's Fiscal Q3 Earnings: ETFs to Tap,2025-05-02
MSFT,Microsoft just made the AI bull case a whole lot stronger,2025-05-02
MSFT,"Big Tech earnings, Amazon & Apple, Tesla denies search: 3 Things",2025-05-02
MSFT,The most bought US stocks in Trump's first 100 days,2025-05-02
MSFT,IBM Extends Microsoft Collaboration: Will the Stock Benefit?,2025-05-02
MSFT,Microsoft Q3 Earnings: Cloud Strength,2025-05-02
MSFT,Microsoft’s strong quarterly earnings show no sign of AI disillusionment—or a Trump tariff hit,2025-05-02
MSFT,"Nvidia stock rises to lead chip gains after Meta, Microsoft back AI investment plans",2025-05-03
MSFT,"Nvidia Stock Jumps as Microsoft, Meta Commit to Continued Heavy AI Spending",2025-05-02
MSFT,Nasdaq Plan Will Bring Zero-Day Option Boom Closer to Single Stocks,2025-05-02
MSFT,Why Nvidia stock is popping after big quarters for Microsoft and Meta,2025-05-02
MSFT,Q3 2025 Microsoft Corp Earnings Call,2025-05-02
MSFT,5 Things to Know Before the Stock Market Opens,2025-05-02
MSFT,"Stocks Rise Pre-Bell Following Upbeat Microsoft, Meta Results; Investors Await More Tech Earnings",2025-05-02
MSFT,Stocks are ignoring that terrifying U.S. GDP report as retail investors buy the dip,2025-05-02
MSFT,Want Exposure to the AI Revolution? This Brilliant Tech ETF Is All You Need.,2025-05-02
MSFT,Mag 7 Ride to Market’s Rescue But It Needs Much More and 5 Other Things to Know Today.,2025-05-02
MSFT,"Trending tickers: Microsoft, Meta, Nvidia, Tesla and Rolls-Royce",2025-05-02
MSFT,"Big Tech's fortunes diverge as AI powers cloud, tariffs hit consumer electronics",2025-05-02
MSFT,"Stock Market Today: Stocks get boost from Microsoft, Meta with jobs data on deck",2025-05-02
MSFT,"Stocks close sharply higher, lifted by Microsoft, Meta earnings",2025-05-02
MSFT,Here's Why I'm Staying Away from Super Micro Stock,2025-05-02
MSFT,Should You Buy the Invesco QQQ ETF During the Nasdaq Bear Market? Here's What History Says,2025-05-02
MSFT,"Down Nearly 20%, This AI Giant Is the Best Bargain ""Magnificent Seven"" Stock Right Now",2025-05-02
MSFT,Microsoft Corp (MSFT) Q3 2025 Earnings Call Highlights: Strong Cloud Growth and AI Demand Drive ...,2025-05-02
MSFT,Microsoft data centre at heart of alleged £3m bribery plot,2025-05-02
MSFT,US risks recession as economy shrinks in tariff war,2025-05-02
MSFT,Watch These Microsoft Price Levels as Stock Surges on AI Cloud Growth,2025-05-02
MSFT,"Microsoft Corporation (MSFT): Still a Core AI Winner? Goldman and Scotiabank Adjust Targets, Not Confidence",2025-05-02
MSFT,Surprising Microsoft earnings sends stock surging,2025-05-02
MSFT,Microsoft CEO Satya Nadella says software is the ‘most malleable resource’ to combat ‘any type of inflationary pressure’,2025-05-02
MSFT,"Microsoft Flexes Muscle in Cloud, Office and Windows as Earnings Jump",2025-05-02
MSFT,Microsoft expects some AI capacity constraints this quarter,2025-05-02
MSFT,Microsoft smashes Wall Street's earnings expectations — and the stock soars,2025-05-02
MSFT,Meta Boosts Spending Plans to Grow Its AI Capacity,2025-05-02
MSFT,"Microsoft Smashes March-Quarter Targets On Cloud, AI Gains",2025-05-02
MSFT,Meta & Microsoft earnings ease tech slowdown fears,2025-05-02
MSFT,Microsoft Wins When Its Competitors' AI Wins: Valoir's,2025-05-02
MSFT,"Meta, Microsoft reports lift AI-related stocks",2025-05-02
MSFT,Microsoft (MSFT) Q3 Earnings and Revenues Beat Estimates,2025-05-02
MSFT,"These Stocks Moved the Most Today: Super Micro, Nvidia, Tesla, Starbucks, Seagate, Norwegian, First Solar, Snap, and More",2025-05-02
MSFT,Microsoft is 'the last thing' CIOs would cut: Jefferies analyst,2025-05-02
MSFT,Microsoft Stock Pops as Cloud and AI Strength Drives Earnings Growth,2025-05-02
MSFT,LinkedIn Reports Record Engagement Once Again in Latest Performance Update,2025-05-02
MSFT,Microsoft says quarterly profits up 18% as it weathers tech sector turbulence with cloud growth,2025-05-02
MSFT,"Microsoft (NASDAQ:MSFT) Beats Q1 Sales Targets, Stock Soars",2025-05-02
MSFT,Microsoft boasts Q3 cloud growth and revenue beat,2025-05-02
MSFT,Microsoft: Fiscal Q3 Earnings Snapshot,2025-05-02
MSFT,Microsoft beats Q3 earnings estimates on top and bottom line on strong cloud bookings,2025-05-02
MSFT,"Microsoft forecasts strong growth for Azure cloud business, shares surge 7%",2025-05-02
MSFT,Microsoft earnings press release available on Investor Relations website,2025-05-02
MSFT,"Microsoft (MSFT), Amazon (AMZN), Meta Platforms (META) to Keep Getting Boosts From the AI Revolution, Renowned Analyst Says",2025-05-02
MSFT,"Economic Contraction Weighs on Equities Ahead of Microsoft, Meta Earnings",2025-05-02
MSFT,Visa partners with AI giants to streamline online shopping,2025-05-02
MSFT,Nvidia gets rare sell rating as Seaport says AI fully priced in,2025-05-02
MSFT,Microsoft (NasdaqGS:MSFT) Elevates Healthcare and IT Management with New Partnerships and Innovations,2025-05-02
MSFT,Microsoft expands European footprint amid global trade tensions,2025-05-02
MSFT,Microsoft faces a high bar as it reports earnings today,2025-05-01
MSFT,"Anthony Scaramucci Once Purchased $1,200 Worth Of Microsoft Stock For His Son In 1992 And Then Forgot About It — Three Decades Later, It Quietly Turned Into A Small Fortune That He Didn't Know He Owned",2025-05-01
MSFT,"Cathie Wood Sees Palantir Dominating Enterprise AI, Wonders How Microsoft Will Manage 'Massive Disruption' — Will Excel Finally Die?",2025-05-01
MSFT,Kolanovic Flags Nvidia as AI Capex Risks Rise,2025-05-01
MSFT,iCAD and Microsoft join forces for AI mammography solutions,2025-05-01
MSFT,"Magnificent 7 Earnings: What to Expect (AMZN, AAPL, META and MSFT)",2025-05-01
MSFT,Microsoft Corporation (MSFT): Among the Best Stocks to Buy According to the Bill & Melinda Gates Foundation Trust,2025-05-01
MSFT,"Microsoft Touts EU Data Center Expansion, Pledges to Protect European Operations",2025-05-01
MSFT,"GDP contracts, Trump's 100 days, Meta & Microsoft: 3 Things",2025-05-01
MSFT,Microsoft vows to protect Europe against Trump,2025-05-01
MSFT,How To Earn $500 A Month From Microsoft Stock Ahead Of Q3 Earnings,2025-05-01
MSFT,Why Big Tech may be set for a surprise rebound through MAGMAN,2025-05-01
MSFT,"At Microsoft she was in charge of professional development for 90,000 employees. She found this trait prevents women from getting promoted",2025-05-01
MSFT,Microsoft pledges to protect European operations and unveils data center expansion,2025-05-01
MSFT,3 Reasons I Keep Buying the Vanguard S&P 500 ETF,2025-05-01
MSFT,IBM unveils Microsoft Practice to advance digital transformation,2025-05-01
MSFT,"Zacks Investment Ideas feature highlights: Amazon, Microsoft and Alphabet",2025-05-01
MSFT,These 3 Funds Offer Sky-High Yields of 15% or More and Trade at a Discount,2025-05-01
MSFT,Microsoft president says company respects European laws amid US criticism,2025-05-01
MSFT,"If You Invested $10K In Microsoft Stock 10 Years Ago, How Much Would You Have Now?",2025-05-01
MSFT,Microsoft CEO says up to 30% of the company's code was written by AI,2025-05-01
MSFT,"Microsoft and Meta earnings, April PCE: What to Watch",2025-05-01
MSFT,"What options trading is telling us now about Amazon, Apple, Meta and Microsoft earnings",2025-05-01
MSFT,Super Micro's Preliminary Results Disappoint,2025-05-01
MSFT,Clearway Energy signs 335 MW power purchase agreement with Microsoft,2025-05-01
MSFT,Big Tech's moment of truth is here,2025-05-01
MSFT,Microsoft Shifts AI Capacity Strategy with OpenAI,2025-05-01
MSFT,Microsoft (NasdaqGS:MSFT) Expands AI and Cloud Collaborations with Health Catalyst and IBM,2025-05-01
MSFT,Is NBIS Stock Worth Investing After a 24% Drop in the Past 3 Months?,2025-04-30
MSFT,AI infrastructure buildout is 'modern space race': Clayco CEO,2025-04-30
MSFT,Nvidia Stock Drops. Where This Analyst Sees a ‘Threat to Sales.’,2025-04-30
MSFT,Better Artificial Intelligence (AI) Stock: SoundHound AI vs. C3.ai,2025-04-30
MSFT,Mag 7: What the technicals are saying about Big Tech stocks,2025-04-30
MSFT,Microsoft and Amazon Capex in Focus Amid Potential AI Pullback,2025-04-30
MSFT,Jim Cramer on Microsoft Corporation (MSFT): “Penalty will be severe” – Azure Must Deliver or Face PE Pressure,2025-04-30
NVDA,Nvidia CEO Jensen Huang gets first salary boost in 10 years,2025-05-03
NVDA,NVIDIA Corporation (NVDA): Among Ken Fisher’s Technology Stock Picks with Huge Upside Potential,2025-05-03
NVDA,Better Artificial Intelligence (AI) Stock: Nvidia vs. Super Micro Computer Inc.,2025-05-03
NVDA,"Nvidia (NVDA) Redesigns Chips to Sidestep U.S. Export Ban, Eyes June China Rollout",2025-05-03
NVDA,"Chip Demand Could Be Slowing, but Does That Make Nvidia Stock a Sell?",2025-05-03
NVDA,Prediction: Nvidia Stock Will Skyrocket After May 28,2025-05-03
NVDA,Does Seaport Research Know Something the Rest of Wall Street Doesn't? Analysts There Just Gave Nvidia a Sell Rating.,2025-05-03
NVDA,Better Artificial Intelligence (AI) Stock: Nvidia vs. Intel,2025-05-03
NVDA,Is NVIDIA (NVDA) the Best NASDAQ Stock to Buy According to Billionaires?,2025-05-03
NVDA,Should You Hold NVIDIA Stock as Meta & Microsoft Double Down on AI?,2025-05-03
NVDA,Nvidia Faces $5.5 Billion Hit as Huang Flags Huawei AI Challenge to Congress,2025-05-03
NVDA,"Magnificent Seven Stocks: Meta, Nvidia, Tesla Rally; Apple Dives On Earnings",2025-05-03
NVDA,Why CoreWeave Stock Rose 11% in April,2025-05-03
NVDA,"Top Stock Movers Now: Dexcom, Berkshire Hathaway, Nvidia, and More",2025-05-03
NVDA,"Trump weighs easing Nvidia chip sales to UAE, Bloomberg reports",2025-05-03
NVDA,Apple and Amazon results show 'Magnificent 7' shaken by Trump's tariff turmoil but still resilient,2025-05-03
NVDA,Nvidia Jumps Past Key Level As Amazon Reports AI Spend Boost; Is Nvidia A Buy Now?,2025-05-03
NVDA,Nvidia Warns: U.S. Policy May Be Handing Huawei the AI Chip Crown,2025-05-03
NVDA,Nvidia Warns Export Curbs Could Cost Billions,2025-05-03
NVDA,Nvidia Stock Rises. It Just Got This Amazon AI Boost.,2025-05-03
NVDA,Why Super Micro Computer Stock Is Plummeting This Week,2025-05-03
NVDA,"Nvidia AI boost, Block cuts outlook, Reddit surges on sales",2025-05-03
NVDA,Nvidia CEO Jensen Huang got his first raise in a decade,2025-05-03
NVDA,"The Zacks Analyst Blog Highlights NVIDIA, Visa, HIVE Blockchain and Accenture",2025-05-03
NVDA,Nvidia (NVDA) Hit With Rare Sell Call as AI Buzz Looks Priced In,2025-05-03
NVDA,"Nvidia is working on China-tailored chips again after US export ban, The Information reports",2025-05-03
NVDA,Nvidia (NVDA) Blasts Anthropic's Support of AI Chip Export Limits,2025-05-03
NVDA,Prediction: 3 Quantum Computing Stocks That Will Be Worth More Than IonQ 10 Years From Now,2025-05-03
NVDA,Jim Cramer Says ‘You Bet Against NVIDIA Corporation (NVDA) At Your Own Peril’,2025-05-03
NVDA,Breakfast News: China Considers Trade Talks,2025-05-03
NVDA,"Netflix Stock Just Notched a New All-Time High. Is This a Brilliant ""Recession-Proof"" Stock Pick?",2025-05-03
NVDA,This Week In AI Chips - Revolutionizing Power Integrity With Movellus PDN Analyzer,2025-05-03
NVDA,"Did Huawei Just Say ""Checkmate"" to Nvidia?",2025-05-03
NVDA,Nvidia slams Anthropic for telling ‘tall tales’ after the AI lab claimed China is smuggling chips in ‘prosthetic baby bumps’,2025-05-03
NVDA,Should You Forget Nvidia and Buy 2 Artificial Intelligence (AI) Stocks Right Now?,2025-05-03
NVDA,Alphabet Just Delivered Fantastic News for Nvidia Shareholders,2025-05-03
NVDA,Tech investing playbook: Evolution of Big Tech dominance,2025-05-03
NVDA,Pay Close Attention to This Crucial Revenue Source for Artificial Intelligence (AI) Giant Nvidia,2025-05-03
NVDA,1 Volatile Stock with Exciting Potential and 2 to Ignore,2025-05-03
NVDA,"Nvidia CEO Jensen Huang Sounds Alarm As 50% Of AI Researchers Are Chinese, Urges America To Reskill Amid 'Infinite Game'",2025-05-03
NVDA,"NVDA Stock Is Not “Fully Pricing in” Its Positive Attributes, Analyst Says",2025-05-03
NVDA,"Intel Planning A Homegrown Challenge To Nvidia, Says It's 'Not A Quick Fix'",2025-05-03
NVDA,Analyst behind Nvidia's only Sell rating names top AI stock pick,2025-05-03
NVDA,"What AI Slowdown? Nvidia Rallies As Meta, Microsoft Boost Data Center Spending.",2025-05-03
NVDA,Flag Top-Rated Stocks Set To Report Like Palantir. Here's How.,2025-05-03
NVDA,Microsoft Briefly Nabs Apple's Crown,2025-05-03
NVDA,Nvidia takes aim at Anthropic's support of chip export controls,2025-05-03
NVDA,Nvidia CEO Warns U.S. AI Controls May Slow Worldwide Tech Adoption,2025-05-03
NVDA,Nvidia raised concerns about Huawei's growing AI capabilities with US lawmakers,2025-05-03
NVDA,Nvidia Eyes UAE Export Easing Ahead of Trump Visit,2025-05-03
NVDA,Nvidia Is Jumping Today -- Is the Artificial Intelligence (AI) Stock a Buy?,2025-05-03
NVDA,Why Are Nvidia Shares Climbing Today,2025-05-03
NVDA,Why Nvidia Stock Bounded Higher Thursday,2025-05-02
NVDA,Nvidia CEO sends Washington 10-word message on AI chip change,2025-05-02
NVDA,"Nvidia, Anthropic reportedly clash over US chip export controls",2025-05-02
NVDA,Nvidia Stock Rises. The AI Trade Is So Back.,2025-05-02
NVDA,Big Tech Stocks Have Had a Magnificent Day So Far,2025-05-02
NVDA,"Artificial Intelligence IPO CoreWeave Pops On Microsoft, Meta Earnings",2025-05-02
NVDA,Nvidia slams Anthropic over shocking claims,2025-05-02
NVDA,US weighs easing Nvidia chip curbs on UAE as Trump plans visit,2025-05-02
NVDA,1 Artificial Intelligence (AI) Stock That Could Go Parabolic,2025-05-02
NVDA,"Nvidia CEO, Qualcomm outlook, Roblox strength: Trending Tickers",2025-05-02
NVDA,The AI trade will have 'multiple winners': Strategist's picks,2025-05-02
NVDA,These are the top 10 April stock purchases on Robinhood U.K.,2025-05-02
NVDA,Jim Cramer on NVIDIA (NVDA): ‘It Will Only Get Worse’,2025-05-02
NVDA,1 Thing Smart Investors Know About Bear Markets,2025-05-02
NVDA,The most bought US stocks in Trump's first 100 days,2025-05-02
NVDA,Bitcoin On Track to Resume Rally: 4 Crypto Stocks in Focus,2025-05-02
NVDA,"Nvidia stock rises to lead chip gains after Meta, Microsoft back AI investment plans",2025-05-03
NVDA,"Nvidia Stock Jumps as Microsoft, Meta Commit to Continued Heavy AI Spending",2025-05-02
NVDA,Nasdaq Plan Will Bring Zero-Day Option Boom Closer to Single Stocks,2025-05-02
NVDA,Why Nvidia stock is popping after big quarters for Microsoft and Meta,2025-05-02
NVDA,Nvidia (NVDA) CEO Warns China AI Gap Narrowing as U.S. Export Curbs Bite,2025-05-02
NVDA,"Nvidia (NVDA) Stock Quotes, Company News And Chart Analysis",2025-05-02
NVDA,3 Best Nasdaq Stocks to Buy in May,2025-05-02
NVDA,Stock Market Sell-Off: Should You Buy the Dip on Nvidia Stock?,2025-05-02
NVDA,Want Exposure to the AI Revolution? This Brilliant Tech ETF Is All You Need.,2025-05-02
NVDA,"Trending tickers: Microsoft, Meta, Nvidia, Tesla and Rolls-Royce",2025-05-02
NVDA,Is NVIDIA Corporation (NVDA) the Best Augmented Reality Stock to Buy According to Hedge Funds?,2025-05-02
NVDA,Should You Buy the Invesco QQQ ETF During the Nasdaq Bear Market? Here's What History Says,2025-05-02
NVDA,Is NVIDIA Corporation (NVDA) the Best Growth Stock to Buy for the Next 3 Years?,2025-05-02
NVDA,Stocks To Watch in May—And What to Watch For,2025-05-02
NVDA,This Incredibly Cheap Semiconductor Stock Is About to Go on a Terrific Bull Run,2025-05-02
NVDA,"Down Nearly 20%, This AI Giant Is the Best Bargain ""Magnificent Seven"" Stock Right Now",2025-05-02
NVDA,Better Artificial Intelligence Stock: SoundHound AI vs. Palantir,2025-05-02
NVDA,Jensen Huang Predicts Annual Data Center Spending Will Hit $1 Trillion by 2028. Here's the Ultimate Semiconductor ETF to Buy Right Now.,2025-05-02
NVDA,Is NVIDIA Corporation (NVDA) the Most Profitable Growth Stock to Buy Now?,2025-05-02
NVDA,3 Tech Stocks You Can Buy and Hold for the Next Decade,2025-05-02
NVDA,Yum Brands Inc (YUM) Q1 2025 Earnings Call Highlights: Strong Growth in Taco Bell and KFC ...,2025-05-02
NVDA,Silicon Motion Technology Corp (SIMO) Q1 2025 Earnings Call Highlights: Navigating Challenges ...,2025-05-02
NVDA,Q1 2025 Yum! Brands Inc Earnings Call,2025-05-02
NVDA,"As Trump Completes 100 Days As President, Elon Musk, Jeff Bezos, Mark Zuckerberg And Other Billionaire Backers See $195 Billion Wealth Wipeout Amid Market Turmoil",2025-05-02
NVDA,"Trump Says Tariffs Politically Risky, But He’s Not Rushing Deals",2025-05-02
NVDA,NVIDIA Corporation (NVDA): Is the AI Hype Overpriced? Seaport Initiates With a Rare ‘Sell’ Call,2025-05-02
NVDA,"Closing Bell Movers: Snap falls 14% after Q1 results, no guidance",2025-05-02
